020418201516, [Case of 20] Campbell Chain Zinc-Plated Forged Steel Anchor Shackle 400 Lb., Apex Tool Group LLC, Hardware > Plumbing > Plumbing Fittings & Supports > Pipe Connectors, Apex Tool Group LLC, https://images.barcodelookup.com/1378/13783360-1.jpg, , Campbell Chain Zinc-Plated Forged Steel Anchor Shackle 400 lb. SOLD ASCase of 20 PRODUCT OVERVIEW Anchor shackle screw pin, carbon steel zinc plated. 1/4 inch. Anchor shackleScrew pinUPC tagged PRODUCT DETAILS Finish: Zinc-Plated Material: Forged Steel Weight Capacity: 400 lb. Connection Method: Screw Pin Color: Silver Eye: 1/4 in.
076335825205, Anvil Mark Closed Eye Bolt 3/16 in. X 1-1/2 in., Anvil Mark, Hardware > Tools > Cutters > Bolt Cutters, Anvil Mark, https://images.barcodelookup.com/3868/38687367-1.jpg, , Zinc Plated Steel Rust Resistant with Hex Nut Closed Eye Upc Label.
076335825212, Anvil Mark Closed Eye Bolt 3/16 in. X 2 in., Anvil Mark, Hardware > Tools > Cutters > Bolt Cutters, Anvil Mark, https://images.barcodelookup.com/3868/38687365-1.jpg, , Zinc Plated Steel Rust Resistant with Hex Nut Closed Eye Upc Label.
076335825229, Closed Eye Bolt 3/16 in. X 2-1/2 in., Anvil Mark, Hardware > Tool Accessories > Drill & Screwdriver Accessories > Drill & Screwdriver Bits, Anvil Mark, https://images.barcodelookup.com/3868/38687369-1.jpg, , Zinc Plated Steel Rust Resistant with Hex Nut Closed Eye Upc Label.
076335825236, Anvil Mark Closed Eye Bolt 1/4 in. X 2 in., Anvil Mark, Hardware > Tools > Cutters > Bolt Cutters, Anvil Mark, https://images.barcodelookup.com/3868/38687358-1.jpg, , Zinc Plated Steel Rust Resistant with Hex Nut Closed Eye Upc Label.
076335825250, Anvil Mark 802525 Closed Eye Bolt 0.25 X 3 In., , Hardware > Tools > Anvils, Anvil Mark, https://images.barcodelookup.com/6984/69844512-1.jpg, , <p>We provide a wide range of products to satisfy all houseware products&#46; We are dedicated to give everyone the very best houseware products for all home needs with a focus on dependability our client satisfaction and great quality&#46; We provide high&#45;quality modern products to be enjoyed by many clients&#46; Our aim is continuous improvement and user satisfaction through effective implementation and quality of our products&#46;</p><b>Features</b><ul><li>Rust Resistant</li><li>with Hex Nut</li><li>Closed Eye</li><li>Upc Label</li><li>Closed Eye Bolt</li></ul><b>Specifications</b><ul><li><b>Size&#58;</b> 0&#46; 25 x 3 in&#46; </li></ul>
076335825267, Closed Eye Bolt 1/4 in. X 4 in., Anvil Mark, Hardware > Tools > Cutters > Bolt Cutters, Anvil Mark, https://images.barcodelookup.com/3868/38687561-1.jpg, , Zinc Plated Steel Rust Resistant with Hex Nut Closed Eye Upc Label.
033923012461, 2 Count Eye Bolt, , Business & Industrial > Industrial Storage, StanleyHardware, https://images.barcodelookup.com/4687/46877881-1.jpg, , 
092503270035, Abbott Rubber 7003PTV 1/4-Inch I.D. X 3/8-Inch O.D. X 100-Ft. Clear Vinyl PVC Tubing, Samar, Animals & Pet Supplies > Pet Supplies > Fish Supplies > Aquarium & Pond Tubing, Samar Company, Inc., https://images.barcodelookup.com/1854/18544417-1.jpg, , 1/4-Inch I.D. x 3/8-Inch O.D. x 100-Ft. Clear Vinyl PVC Tubing.
051643061804, Heavy-Duty Bungee Cords, Dichromate Hooks, 24 in L, Keeper®, Electronics > Communications > Telephony > Corded Phones, Keeper®, https://images.barcodelookup.com/1424/14242640-1.jpg, 0.75, Keeper Heavy-Duty Bungee Cords Industrial strength cord with corrosion resistant dichromate hooks. 100% more rubber inside. 3Xs the tension of regular bungee cord Pack of 10.
051643061859, [Case of 10] Keeper Black Bungee Cord 40 in. L X 0.374 in. 06185, Hampton Products International Corp, Electronics > Communications > Telephony > Corded Phones, Hampton Products International Corp, https://images.barcodelookup.com/1192/11922073-1.jpg, 0.79, Keeper Black Bungee Cord 40 in. L x 0.374 in. 06185 SOLD ASCase of 10 PRODUCT OVERVIEW Keeper Super Heavy Duty Bungee Cords are ideal equipment for all situations that demand extra strength. Fabricated from cord that contains 10 percent more rubber than conventional cords, Heavy Duty Bungee Cords deliver up to 2 times the tension of normal bungees. Dichromate hooks are also three times more sturdy than the standard, resisting corrosion for long-lasting toughness. Keeper industrial strength premium bungee cords are the perfect solution for commercial applications that require a product that is innovative, dependable and sturdy. Bungee stretch cordExtra heavy duty industrial quality cordExtra strong with double layer, solid colored, braided jacket and dichromated hooks13/32" width40" length PRODUCT DETAILS Color: Black Length: 40 in. Thickness: 0.374 in. Multiple Sizes: No Material: Rubber/Steel Carabiner Included: No Weather Resistant Hooks UV Protected UV, chemical & water resistant. Hooks are dichromate dipped for extra rust protection. Has triple the pull tension and hook strength of standard stretch cords.
051643061927, [Case of 8] Keeper Black Bungee Cord8 in. L X 0.374 in., Hampton Products International Corp, Hardware > Hardware Accessories > Chain, Wire & Rope > Bungee Cords, Hampton Products International Corp, https://images.barcodelookup.com/1394/13944473-1.jpg, 0.2, Keeper Black Bungee Cord8 in. L x 0.374 in. SOLD ASCase of 8 PRODUCT OVERVIEW Keeper Super Heavy Duty Bungee Cords are ideal equipment for all situations that demand extra strength. Fabricated from cord that contains 10 percent more rubber than conventional cords, Heavy Duty Bungee Cords deliver up to 2 times the tension of normal bungees. Dichromate hooks are also three times more sturdy than the standard, resisting corrosion for long-lasting toughness. Keeper industrial strength premium bungee cords are the perfect solution for commercial applications that require a product that is innovative, dependable and sturdy. 18 inch heavy duty bungee cordIndustrial strength cordCorrosion resistant dichromate hook10 percent more rubber inside2x the tension of regular bungee cord PRODUCT DETAILS Color: Black Length: 18 in. Thickness: 0.374 in. Weather Resistant Multiple Sizes: No Hooks Carabiner Included: No Material: Rubber/Steel UV Protected Has triple the pull tension and triple the hook strength. Industrial quality. Dichromate hooks.
000346279627, [Case of 4] Bosch Bulldog 1/4 in. X 6 in. L Steel SDS-plus Rotary Hammer Bit, Robert Bosch Tool Corp, Hardware > Tool Accessories > Drill & Screwdriver Accessories > Drill & Screwdriver Bits, Robert Bosch Tool Corp, https://images.barcodelookup.com/1511/15110083-1.jpg, 0.1, Bosch Bulldog 1/4 in. x 6 in. L Steel SDS-plus Rotary Hammer Bit SOLD ASCase of 4 PRODUCT OVERVIEW Carbide tipped for long life in tough applications. Centric tip ensures quick starts in concrete. Wear mark alerts user when tip wears beyond ANSI specification. Bit runs cooler thanks to improved flute design. Rotary hammer bits feature a patent-pending 4-flute design for fast dust removal1/4 in. x 4 in. x 6 in.6 in. lengthOptimized brazing and hardening process for long life15 percent faster (compared to S4L)Bosch-made carbide tip is tougher and more durable under heavy loadsIdeal for anchoring and through hole applications in concreteProprietary Bosch hardening process results in more holes per bit PRODUCT DETAILS Diameter: 1/4 in. Overall Length: 6 in. Material: Steel Usage: For Anchoring and Through-Hole Applications in Con Flute Length: 4 in. Shank Type: SDS-Plus Shank.
022315100022, FLOTEC FP0S1300X Utility Pump, 115V, 1/6HP, FLOTEC, Hardware > Hardware Pumps > Utility Pumps, FLOTEC, https://images.barcodelookup.com/1852/18529824-1.jpg, 6.4, Utility Pump,115V,1/6HP. This item has been restricted from sale in the following state(s): [].
079055008057, Arrow Fastener Rla1/8 Long Aluminum Rivet, 1/8", Arrow Fastener, Hardware > Tools > Punches & Awls, Arrow Fastener, https://images.barcodelookup.com/1635/16358012-1.jpg, 0.04lb, Use aluminum rivets for lighter weight jobs and materials such as aluminum, fabrics, plastics, leather, etc, grip length: 1/2", 15 per pack.
079055008040, Arrow Fastener Rma1/8 Medium Aluminum Rivet, 1/8", Arrow Fastener, Hardware > Tools > Riveting Tools > Rivet Guns, Arrow Fastener, https://images.barcodelookup.com/1424/14244649-1.jpg, 3, Use aluminum rivets for lighter weight jobs and materials such as aluminum, fabrics, plastics, leather, etc, 20 per pack, grip length: 1/4".
079055008033, Arrow Fastener RSA1-8 0.13 in. Aluminum Short Rivet, 25 Pack, Arrow Fastener, Hardware > Plumbing > Water Levelers, Arrow Fastener, https://images.barcodelookup.com/1431/14319534-1.jpg, 13.00lb, Features Produces a strong, permanent, tamper-proof joint quickly and easily Rivet will not strip out or vibrate loose like threaded fasteners For joining sheet metal, aluminum, fabrics, plastics, and leather Use on metal cabinets, aluminum doors, and windows, metal fixtures, automobiles, heating ducts, gutters, and downspouts Size - 1/8 in. Finish - Aluminum Pack - 25.
042526611087, Irwin Industrial 61108 Lite Duty Masonary Bit, .13 X 3 in., Irwin Industrial, Hardware > Tool Accessories > Drill & Screwdriver Accessories > Drill & Screwdriver Bits, Irwin Industrial, https://images.barcodelookup.com/1493/14935772-1.jpg, 0.1, Features Rotary percussion bits made of chrome vanadium shaft through hardened to 50-53hrc. Shot-peened, double tempered finish reduces breakage, copper braze material gives high heat resistance and flute geometry removes dust from the hole quicker for fast drilling and long life. Used in applications such as rotary drilling in concrete, brick and masonry. Size - 1/8 x 3 in. Item weight - .02.
043374491685, M-d Products 49168 M-d Products 49168 .13 in. Tile Spacers 200-Bag, M-D Building Products Inc, Hardware > Tool Accessories > Paint Tool Accessories > Paint Roller Accessories, M-D Building Products Inc, https://images.barcodelookup.com/1847/18477202-1.jpg, 2.79lb, <li>Injection molded for precise grout lines<li>Creates a 3/8" grout line<li>Works with tile, ceramic, porcelain, stone, and marble<li>Color coded by size<li>Evenly space tiles for uniform grout lines and provide quick, professional looking result. Works with all sizes of ceramic tile, porcelain, stone and marble, color code by size to help identify size quickly.<li>Length: 6.13<li>Width: 5.
010306100267, [Case of 8 Packs] QEP 1/8 in. H X 0.5 in. W Plastic Tile Spacer (250 per Pack), Qep Co Inc, Hardware > Hardware Accessories > Hardware Fasteners > Screws, Qep Co Inc, https://images.barcodelookup.com/1282/12823183-1.jpg, 0.2, QEP 1/8 in. H x 0.5 in. W Plastic Tile Spacer SOLD ASCase of 8 packs (250 per pack) PRODUCT OVERVIEW The QEP 1/8 in. Tile Spacers keep grout lines the same width and help to line up tiles at the corners when installing ceramic floor or wall tiles. The spacers are made from flexible PVC for ease in placing and adjusting tiles. Works with all sizes of ceramic tile, porcelain, stone and marblePrecision cut for accuracyProvide quick, professional looking results PRODUCT DETAILS Height: 8 in. Width: 0.5 in. Material: Plastic Color: White Comfort Grip: No.
019442147068, LDR 90  Elbow, Ldr, Home & Garden > Bathroom Accessories > Bathroom Accessory Mounts, Ldr, https://images.barcodelookup.com/2970/29700554-1.jpg, , Features:  -All fittings are pressure tested, 150 PSI.  -Zinc coating is applied by hot dip process.  -Drain application.  Product Type: -Supply elbow/Wall outlet. Dimensions: Diameter 0.5" -  Overall Width - Side to Side: -0.5". Diameter 0.13" -  Overall Width - Side to Side: -0.13". Diameter 0.25" -  Overall Width - Side to Side: -0.25". Diameter 0.38" -  Overall Width - Side to Side: -0.38".
045325133019, [Case of 3] Vermont American 1/8 in. X 2-1/4 in. L Carbide Glass and Tile Bit, Robert Bosch Tool Corp, Hardware > Hardware Accessories > Hardware Fasteners > Screws, Robert Bosch Tool Corp, https://images.barcodelookup.com/1310/13101308-1.jpg, 0.1, Vermont American 1/8 in. x 2-1/4 in. L Carbide Glass and Tile Bit SOLD ASCase of 3 PRODUCT OVERVIEW Glass and tile drill bits provide smooth, accurate drilling in ceramic tile, marble, china, mirrors and glass. The spear-pointed tip design reduces breakout and the bit features a carbide tip for extended bit life. These bits are ideal for drilling fastener holes in bathroom tile or wall mirrors. Smooth accurate drilling in glass, tile, marble, china and mirrorsSpear-pointed tip design reduces breakoutIdeal for drilling fastener holes in bathroom tile or wall mirrorsCarbide-tipped for long lifeFits drills with 3/8 in. or larger chucks1/8 in. Diameter2-1/4 in. overall length PRODUCT DETAILS Drill Size: 1/8 in. Overall Length: 2-1/4 in. Material: Carbide Usage: For Smooth Drilling in Ceramic Tile Shank Type: Straight Shank.
020418201646, Campbell Chain Quick Link 220 Lb 1/8" Dia., , Hardware > Tool Accessories > Drill & Screwdriver Accessories > Drill & Screwdriver Bits, Apex Tool, https://images.barcodelookup.com/5223/52231551-1.jpg, , 
082472308815, LENOX 30881VB1 HSS Step Drill Bit 13 Sizes, 1/8-1/2", Lenox, Hardware > Tool Accessories > Drill & Screwdriver Accessories > Drill & Screwdriver Bits, Lenox, https://images.barcodelookup.com/430/4306963-1.jpg, , Carpenters, contractors and metal workers all find step drill bits to be a time saver because the bit doesn't need to be changed each time a different hole size needs to be drilled. Here is some additional information about Lenox Step Drill Bit. Material: HSS, Finish: Steam Oxide. This item has been restricted from sale in the following state(s): [].
092503271018, 3/16odx1/8idx200ft Vnyl Tubing, SAMAR COMPANY INC, Animals & Pet Supplies > Pet Supplies > Fish Supplies > Aquarium & Pond Tubing, SAMAR COMPANY INC, https://images.barcodelookup.com/4027/40270949-1.jpg, , 3/16odx1/8idx200ft Vnyl Tubing.
037103063304, Hi-Viz Series 1000 Power Return Tapes - HV1010, , Hardware > Tools > Measuring Tools & Sensors > Tape Measures, Cooper tools apex, https://images.barcodelookup.com/7278/72781776-1.jpg, , Hi-Viz case - easy to find on the job. Case designed to fit perfectly in the hand. Lightweight, high strength case. Fits easily into most tape holsters. Bright yellow blade has clear easy-to-read numerals. Toggle lock is positioned for convenient operation and holds the blade securely in any position. Virtually unbreakable Quad Hook. Cushioned blade return.
037103063311, 1/2"  X  12'  Hi-Viz  Orange  Series  1000  Power  Tape, Lufkin, Hardware > Tools > Measuring Tools & Sensors > Tape Measures, Lufkin, https://images.barcodelookup.com/4643/46439191-1.jpg, , Hi-Viz  orange  case  -  easy  to  find  on  the  job  Case  designed  to  fit  perfectly  in  the  hand  Lightweight,  high  strength  case,  fits  easily  into  most  tape  holsters  Bright  yellow  blade  has  clear  easy-to-read  numerals  Toggle  lock  is  positioned  for  convenient  operation  Holds  the  blade  securely  in  any  position  Cushioned  blade  return  Removable  belt  clip  All  shelf  pack  power  tapes  are  carded.
076812585066, Great Neck 58506 10 in. Grooved Joint Plier, Great Neck, Hardware > Tools > Pliers, Great Neck, https://images.barcodelookup.com/6166/61664332-1.jpg, 0.44lb, 10 in. Grooved Joint Plier Secure Grip groove joint pliers. Precision machined and heat treated jaws for secure grip. Drop-forged steel for strength and durability. Chrome finished to resist rust. Ergonomic rubber grip handle with Sheffield Oval-Grip pattern. Specifications Size: 10 in. Weight: 1.05 lbs.
084389019112, G01911 10 in. Brick Trowel London, Goldblatt, Home & Garden > Lawn & Garden > Gardening > Gardening Tools > Lawn & Garden Sprayers, Goldblatt, https://images.barcodelookup.com/324/3247887-1.jpg, 4.99lb, <b>Features</b><ul><li>Brick Trowel London</li><li>Economy Brick Trowels Made Of Carbon Steel</li><li>Welded Shank & Sturdy Wood Handle</li><li>Size - 10 in.</li><li>Dimension - 15.2 x 5 x 3.9 in.</li><li>Item Weight - 0.83 lbs.</li></ul>.
076812010995, Great Neck Saw Adjustable Frame Hacksaw  HF10, Great Neck Saw Mfg. Inc., Hardware > Tools > Pliers, Great Neck Saw Mfg. Inc., https://images.barcodelookup.com/110/1106571-1.jpg, 0.01lb, <li>Accommodates blades from 10" to 12" long                                                                                                                                                                                                                  <li>Adjusts to cut at four different angles                                                                                                                                                                                                                   <li>Handles are tough, colorful plastic                                                                                                                                                                                                                       <li>Heavily plated frames                                                                                                                                                                                                                                     <li>Replacement 10" (2524-0854) and 12" (2524-0888) blades                                                                                                                                                                                                    <li>Carded.
024826201076, Behrens Galvanized Steel Pail, Behrens, Hardware > Hardware Accessories > Tool Storage & Organization > Tool Organizer Liners & Inserts, Behrens, https://images.barcodelookup.com/3876/38760131-1.jpg, , Whether you're spending the day working in the yard or hanging with friends, the Behrens Hot Dipped Steel Beverage Pail will keep your drinks cold. Made from hot dipped steel, this strong and durable pail is rodent proof, weather-resistant, won't rust, won't absorb odors, and is also recyclable. Featuring an offset bottom to keep the pail off the ground, large handles, and deep wedging to add strength, this pail comes in a variety of sizes and not only holds drinks, but can also be used as a planter, storage container, décor, and more. With a majority of products manufactured in the United States, Behrens has been producing the highest quality metal containers since 1911. They use only the highest quality productions standards and materials to ensure their customers receive the best in US made products. (ARET205-4)
022384072176, [Case of 3] Shur-Line 2-1/2 in. W Carbon Steel 10-in-1 Multi-Purpose Scraper Tools, Nova Wildcat Shur-Line LLC, Hardware > Building Consumables > Painting Consumables > Stains, Nova Wildcat Shur-Line LLC, https://images.barcodelookup.com/1900/19008119-1.jpg, 0.5, Shur-Line 2-1/2 in. W Carbon Steel 10-in-1 Multi-Purpose Scraper Tools SOLD ASCase of 3 PRODUCT OVERVIEW Shur-Line continues to develop new products that are easy to use and offer great results regardless of the skill of the painter - making them ideal for homeowners and contractors alike. Since the inception of our first blade edger in the 1950s, Shur-Line has been the leader in designing convenience tools that make painting projects easier, faster and even fun. Clear coated blade to resist corrosion and rustingCarbon steel full tang bladeMulti-purpose tool for whatever task interrupts your painting projectErgonomic handle with soft comfort grip PRODUCT DETAILS Blade Width: 2.5 in. Blade Material: Carbon Steel Blade Type: 10-in-1 Color: Red / Black Overall Length: 8.7 in. Length: 2-1/2 in. Material: Carbon Steel Handle Material: Plastic.
024826110286, Behrens Bf20 Multi Purpose Tin Funnel, 10 Oz, , Sporting Goods > Indoor Games > Multi-Game Tables, , https://images.barcodelookup.com/5223/52230916-1.jpg, , 
073149092830, [Case of 12] Sterilite 10 Qt. Bucket Red, Sterilite Corporation, Home & Garden > Kitchen & Dining > Tableware > Serveware Accessories, Sterilite Corporation, https://images.barcodelookup.com/1517/15174177-1.jpg, 0.08lb, Sterilite 10 qt. Bucket Red SOLD ASCase of 12 PRODUCT OVERVIEW The 10 quart Spout Pail is designed with a large opening to accommodate a mop, along with a spout for controlled pouring. The color-accented handle provides a comfortable grip surface for easy transporting. The pail offers durable construction and an easy-to-clean surface. Large opening accommodates a mopSpout provides a controlled pourHandle for comfortable carryingDurable construction PRODUCT DETAILS Capacity: 10 qt. Color: Red Shape: Round Commercial and Residential Material: Plastic Single spout.
073149120106, Sterilite 11205812 Spout Pail, 10 quart, , Health & Beauty > Health Care, Sterilite-Massillon, OH, https://images.barcodelookup.com/1185/11850296-1.jpg, , Sterility 11205812 10 Quart Spout Pail Comfortable carry handle Accepts standard sized sponge mops "No-spill" spout design and hand grip molded in base allow for smooth controlled pouring Plastic Lapis color 10 quart, 11-3/4" x 11-3/8" x 10". This Product is manufactured in United States.
040094501991, Hamilton Beach 10 Speed Blender, Hamilton Beach, Electronics > Speed Radars, HAMILTON BEACH INC., https://images.barcodelookup.com/2963/29639005-1.jpg, , Hamilton Beach 10 Speed Blender.
076174874716, Adjustable Wrenches, 10 in Long, 1 1/4 in Opening, Chrome, Stanley® Products, Hardware > Tools > Wrenches, Stanley® Products, https://images.barcodelookup.com/1736/17361368-1.jpg, 0.9, Stanley Adjustable Wrenches Slip-resistant bi-material cushion grip. Knurl turns smoothly for easy operation. Laser etched SAE and metric scale on jaw Pack of 1.
037064091606, Allway SX10F 10 in. Tape Knife Soft Grip, Allway, Hardware > Tools > Measuring Tools & Sensors > Measuring Scales, Allway, https://images.barcodelookup.com/7459/74594615-1.jpg, 1, Features Tape knife soft grip. Stainless steel blades are hollow ground for peak performance. Blades are flexible, yet strong enough to retain blade flatness. Corrosion proof blade tang extends the full length of the handle. Feather soft handle will not slip even when wet with drywall mud. Hammer end to tap in loose nails. M2 hardened phillips bit retained, both in storage and operating positions by two powerful neodymium magnets. Size - 10 in.
024721001887, Irwin Industrial 12In 10/14Tpi Recip Blade 372110, Irwin Industrial, Hardware > Tools > Tool Sets > Hand Tool Sets, Irwin Industrial, https://images.barcodelookup.com/1436/14369568-1.jpg, 0.2, Features Electronic beam weld allows for a more powerful bond. Bi-Metal blade increase blade life. Use with materials 1/8 - 1/2 in. (3.2-1.3 mm.) thick. Applications - Composition Materials, Plastic, Pipe, Carbon Steel and Stainless Steel. Size - 12 in. 10/14 Tpi.
024721001870, Irwin 372610 Reciprocating Saw Blade, 6", 10tpi, Irwin, Hardware > Tools > Saws > Band Saws, Irwin, https://images.barcodelookup.com/1327/13271662-1.jpg, 3.45lb, Bi-metal construction for faster cutting Stand up to tough professional applications. Electronic beam weld allows for a more powerful bond. Fits all brands of cordless reciprocating saws.
024721001825, Irwin Industrial Tool 8in. 10 TPI Metal & Wood Reciprocating Saw Blade 372810, Irwin Industrial Tool, Home & Garden > Lawn & Garden > Gardening > Gardening Tools > Bulb Planting Tools, Irwin Industrial Tool, https://images.barcodelookup.com/1256/12562184-1.jpg, 10, Reciprocating saw blade Cuts composition materials, plastic, pipe, carbon steel and stainless steel Use with materials .13" and thicker Electronic beam weld for stronger, longer lasting teeth Bi-metal construction for faster cutting and added durability Precision set teeth for faster, smoother cuts WeldTec tooth design 10 TPI 8" Length: 11.13 Width: 0.25 Height: 1.88.
024721010322, Irwin 372960 Demolition Reciprocating Saw Blade, 9", 10 Tpi, Irwin Industrial Tools, Hardware > Tools > Saws > Band Saws, Irwin, https://images.barcodelookup.com/1332/13320387-1.jpg, 0.2, .Highlights: .For heavy duty and demolition applications in wood and metal.Use with materials 3/16" (5mm) and thicker.Electronic beam weld for stronger, longer lasting teeth.Bi-metal construction for faster cutting and added durability.Precision set teeth for faster, smoother cuts.8% Cobalt keeps teeth sharp longer.Specifications:. .Type.Demolition.Blade Length.9".Teeth Per Inch.10 TPI.Material.Bi-Metal.Applications.Wood and metal 3/16" and thicker. .
029274151799, [Case of 10] Knape & Vogt Black Steel Regular Duty Bracket 16 Ga. 10 in. L 160 Lb., Knape & Vogt Mfg Co, Hardware > Hardware Accessories > Brackets & Reinforcement Braces, Knape & Vogt Mfg Co, https://images.barcodelookup.com/1199/11995712-1.jpg, 0.5, Knape & Vogt Black Steel Regular Duty Bracket 16 Ga. 10 in. L 160 lb. SOLD ASCase of 10 PRODUCT OVERVIEW This 10 inch bracket features a shelf retaining lip and a spring clip for stability and friction lock. Holds up to 320 lbs. per pair when properly installed. Two locking teeth easily lock into wall standard. For use with the 80 series standards. Black finish. A perfect blend of strength and beauty in wide selection of both size and finishesBrushed plated steel and painted finishes provide finished looks for both decorator and utility applicationsBack clip feature assures firm square hold and perfect shelf alignmentBlack10" PRODUCT DETAILS Color: Black Material: Steel Bracket Type: Regular Duty Gauge: 16 Ga. Length: 10 in. Capacity: 160 lb. Adjustable Intervals: 1 in. Width: 0.5 in. Height: 2.5 in. Screws Included: No Mount Type: Wall Mount Usage: For Single Slot Standards This bracket features a shelf retaining lip and a spring clip for stability and friction lock Holds up to 320 lbs. per pair when properly installed Two locking teeth easily lock into wall standard (sold separately) For use with the 80 Series standards.
