076818010012, SHOE GOO 110011 Shoe Repair Adhesive, Multi-Purpose, Shoe Goo, Hardware, Shoe Goo, https://images.barcodelookup.com/1450/14504502-1.jpg, 0.3, California Proposition 65: This product contains a chemical known to the State of California to cause cancer. Shoe Repair Adhesive, Glue Purpose All Purpose, Materials Bonded Leather, Rubber, Fabric, Canvas, Characteristics Water Resistant Immediately Upon Application, Container Type - Adhesives Tube, Container Size - Adhesives 3.70 oz, Begins to Harden - Adhesives 2 to 20 min, Full Cure Time - Adhesives 1 to 3 days, Adhesive Color Clear, Temp. Range -40 Degrees to 150 Degrees F, Uses Leather, Rubber, Vinyl and Canvas. This item has been restricted from sale in the following state(s): [].
046587001047, Prier Products #07   11-1/2-Inch Silent Anti Siphon Brass Ballcock, , Home & Garden > Decor > Bird Baths, Prier Products Inc, https://images.barcodelookup.com/5347/53472417-1.jpg, , Prier Products 07 11-1/2-Inch Silent Ballcock.
046135111808, Sylvania Lighting 60W/IF/4PK "Inside Frosted" Light Bulb 60w(pack of 12), , Home & Garden > Lighting > Light Bulbs > LED Light Bulbs, Sylvania, https://images.barcodelookup.com/5505/55051167-1.jpg, , 
046135112256, Sylvania Lighting 75W A19 Incandescent Light Bulb, Clear, 4-Pack, , Home & Garden > Lighting > Light Bulbs > LED Light Bulbs, , https://images.barcodelookup.com/5234/52345211-1.jpg, , 
075877961136, 113 Piece Self Stick Home Protection Kit, World And Main, Furniture > Chair Accessories > Hanging Chair Replacement Parts, World And Main, https://images.barcodelookup.com/1275/12755380-1.jpg, , Felt Pads.
073963115333, Berry Plastics 1372523 33 Gal Trashbag, 15 Count - Large, Berry Plastics, Home & Garden > Household Supplies > Trash Compactor Accessories, Berry Plastics, https://images.barcodelookup.com/2162/21624105-1.jpg, 3.18lb, We provide a wide range of products to satisfy all houseware and supplies. We are dedicated to give everyone the very best houseware supplies for all home needs, with a focus on dependability, our client satisfaction and great quality. We provide high-quality modern products to be enjoyed by many clients. Our aim is continuous improvement and user satisfaction through effective implementation and quality of our products. Features Trashbag 15 Count Specifications Capacity: 33 gal Size: Large.
045923072567, Satco S7256 11W R20 Reflector Screw-in 5000K Fluorescent Bulb, Satco, Home & Garden > Lighting > Light Bulbs > LED Light Bulbs, Satco, https://images.barcodelookup.com/8922/89220712-1.jpg, , Satco S7256 11W R20 Reflector Screw-In 5000K fluorescent bulb Shape: R20 Reflector Watts: 11W Base: E26 Medium Screw Luminous Flux: 330LM Color Temperature: 5000K Maximum Overall Length: 4.96 inch.
075877000323, Bright - Way, FC12T9, Cool White, Circline Fluorescent T9 12' 32 Watt Tube Light Bulb, Bright-Way, Home & Garden > Lighting > Light Bulbs > LED Light Bulbs, Bright-Way, https://images.barcodelookup.com/1256/12566187-1.jpg, , Cool White.
022333435014, Proctor Silex 12 Cups White Coffee Maker, Hamilton Bch/Proctor Silx, Furniture > Cabinets & Storage > Storage Cabinets & Lockers, Hamilton Bch/Proctor Silx, https://images.barcodelookup.com/64/644292-1.jpg, 5.4, Proctor Silex 12 cups White Coffee Maker PRODUCT OVERVIEW Perk up your mornings with rich, aromatic coffee brewed in the Hamilton Beach Coffee Maker (model 43501Y). Featuring auto pause and serve settings for ultimate convenience, the 12-cup Coffee Maker is ideal for everyday use at home or in the office. This Proctor-Silex Coffee Maker comes with a dishwasher-safe glass carafe. Brews 12 cupsNon-programmableGlass carafePause and serveReservoir water level marksWhite12 cup capacity PRODUCT DETAILS Capacity: 12 cups Color: White Length: 8.5 in. Built In Timer: No Height: 11 in. Dishwasher Safe Parts Filter Type: Permanent Water Filtration Programmable: No Width: 8.5 in. Keep Warm Setting: No 2-12 cup Auto pause & serve Automatic drip Pull out filter basket Flip up reservoir lid Reservoir water level marks Dishwasher safe carafe and filter basket On/off switch Integral keep hot plate.
070686730409, AmerTac 73040CC 12-Inch Fluorescent Lite, AmerTac, Home & Garden > Lighting > Light Bulbs > LED Light Bulbs, Amertac, https://images.barcodelookup.com/2210/22107533-1.jpg, , The AmerTac 73040CC 12-Inch Fluorescent Lite is the perfect fit for any room. It does require 8 AA batteries or an AC/DC adaptor. AmerTac offers a full range of distinct decorative home accent products that include stylish Wallplates, money-saving LED Nite Lites, innovative Under Cabinet Lighting, and convenient LED Battery Operated Lights. The more functional product lines include energy-saving Timers, Dimmers, and Lighting Controls; plus an extensive offering of Consumer Electronics Accessories for the home and office. Our products are distributed to leading home centers, lighting showrooms, mass merchandisers, along with major drug and supermarket chains throughout North America.
028452102226, Mayes 10222 12" Yellow Steel Square (Measures&levels), Mayes, Hardware > Tools > Measuring Tools & Sensors > Squares, Mayes, https://images.barcodelookup.com/2016/20168675-1.jpg, 0.11lb, Mayes 10222 12" Yellow Steel Square (Measures&levels). Painted black finish Permanently stamped numbers, rafter tables and graduations in white 12" x 2" body length 8" x 1-1/2" tongue length Material: Metal, Plastic.
075877975614, 12 LED Headlamp Headlight Adjustable 4 Modes W/ LED Keychain 3AAA Batteries, China, Hardware > Tools > Flashlights & Headlamps, China, https://images.barcodelookup.com/8088/80888399-1.jpg, , Kurt Cobain once said, 'The sun is gone, but I have a light'. You too can have a light after the sun goes down, hands free! This H.B. Smith 12 Bulb LED Headlamp with Bonus LED Keychain light fits comfortably around your head and illuminates without having to hold a flashlight. It's perfect for working in an area where you'll need hands: hiking, bike riding, even jogging at night! This lightweight and easy to use headlamp features 4 lighting modes, including a 'strobe' mode for when you just want to party. The headlamp runs on 3 AAA batteries (included) and comes with a bonus LED keychain light to make sure you're never left in the dark.
075877045676, 104567 12 LED Camping Lantern with 3D Battery, Bright-Way, Sporting Goods > Outdoor Recreation > Camping & Hiking > Camping Lights & Lanterns, Bright-Way, https://images.barcodelookup.com/15130/151304845-1.jpg, 0.01lb, <p>Lantern 12 LED Camping with 3D Battery </p><p>Our products are assured for reliability and durability which has high quality and standard. Our products are designed with the up to date designs and creativity. We always work towards to fulfill the requirements of our end users. </p><p>Bright way, all your handheld lighting solutions. All our products are made and tested to be reliable in all situations. </p><b>Specifications</b><ul><li><b>Weight:</b> 0.5 lbs</li></ul>.
075691606411, Singer Polyester Thread 25 Yd Spools, Dark Shades, 12pk, Singer Notions, Toys & Games > Games > Card Games, Singer Notions, https://images.barcodelookup.com/1995/19959389-1.jpg, 2.76lb, Colorfast and washableIncludes 3 needles and 1 threaderWarning: this is a sharp product.
071691223511, Rubbermaid Neat And Tidy Bucket, Rubbermaid, Health & Beauty > Health Care, Radius Garden Llc, https://images.barcodelookup.com/4622/46225462-1.jpg, 700, Neat N Tidy Bucket 11qt
071691223733, Rubbermaid FG296400ROYBL Roughneck Square Utility Bucket, 12 Quart, Plastic, Rubbermaid, Business & Industrial > Janitorial Carts & Caddies, Rubbermaid, https://images.barcodelookup.com/3816/38169640-1.jpg, , Highlights: Size: 12 Qt Color: Royal Blue Length: 11-1/2" Height: 10" Width: 12-1/2" Material: Plastic Type: Square Heavy duty wire bails offer extra durability for heavy use Twin spouts guide water flow from either side Recessed grips on bottom allow easy controlled pouring Handle grips designed for comfortable carrying.
046013401335, 12" Table Fan, 3 Speeds, Lasko, Home & Garden > Household Appliances > Climate Control Appliances > Fans > Ceiling Fans, Lasko, https://images.barcodelookup.com/1127/11279551-1.jpg, 6.1, The Lasko 2012 12 In. Table Fan, in white, is perfect when extra space is at a premium. With wide-area oscillation, adjustable tilt-back and a compact head, this stylish, 3-speed fan covers a wide area in a minimum of space. When the weather heats up, you can count on this fan to create a soothing, summer breeze in any room.
079085107126, The Lehigh Group 10712-110-070-05 Clothesline, .21 X 100 Ft., The Lehigh Group, Hardware > Hardware Accessories > Chain, Wire & Rope > Chains, The Lehigh Group, https://images.barcodelookup.com/1131/11316496-1.jpg, 5.70lb, Manufactured with a jacket of lock-stitched cotton and synthetic yarns. Popular as a pulley line in large metropolitan cities. Easily tied and will withstand the wear and tear of being frequently put up and taken down. Diameter sized for secure clothespin gripping. 7/32 in Nominal Diameter. Labeled and shrink-wrapped hank.Dimension - 18.23 x 28.25 x 22.64.Item Weight - .62 lbs.- SKU: ORGL2248.
075877121608, Howard Berger V1216 Reinforced Plastic Tarp - 12 X 16 Ft., Howard Berger, Home & Garden > Lighting > Track Lighting > Track Lighting Accessories, Howard Berger, https://images.barcodelookup.com/1117/11173936-1.jpg, 2.45, This blue Reinforced Plastic Tarp is double-laminated and has an extra-strength weave, making it very heavy-duty. It is even sun- and fade-resistant. The hem is reinforced with rope. Metal grommets are placed about every 3 ft. to help hold the tarp in place. Features Heavy-duty reinforced plastic tarp with double-laminated coating Easy-to-see blue color Metal grommets help hold tarp in place Extra-strength weave Sun- & fade-resistant No leaks or tears Size - 12 x 16 ft.
029274006075, [Case of 8] Knape & Vogt White Steel Regular Duty Bracket 16 Ga. 12 in. L 160 Lb. 180 WH 12, Knape & Vogt Mfg Co, Hardware > Hardware Accessories > Brackets & Reinforcement Braces, Knape & Vogt Mfg Co, https://images.barcodelookup.com/1188/11889664-1.jpg, 0.5, Knape & Vogt White Steel Regular Duty Bracket 16 Ga. 12 in. L 160 lb. 180 WH 12 SOLD ASCase of 8 PRODUCT OVERVIEW This 12 inch bracket features a shelf retaining lip and a spring clip for stability and friction lock. Holds up to 320 lbs. Per pair when properly installed. Two locking teeth easily lock into wall standard (sold separately). For use with the 80 series standards. 12 inch size length16 gauge size thicknessMade of cold rolled and spring steelWhite finish PRODUCT DETAILS Color: White Material: Steel Bracket Type: Regular Duty Gauge: 16 Ga. Length: 12 in. Capacity: 160 lb. Width: 0.5 in. Height: 2.5 in. Usage: For Single Slot Standards Mount Type: Wall Mount Adjustable Intervals: 1 in. Screws Included: No This 12 in. bracket features a shelf retaining lip and a spring clip for stability and friction lock Holds up to 320 lbs. per pair when properly installed Two locking teeth easily lock into wall standard (sold separately For use with the 80 Series standards.
045923773921, Nuvo Lighting  77/392  Ceiling Fixtures  Indoor Lighting  Flush Mount  ;White, Nuvo Lighting, Home & Garden > Lighting > Lighting Fixtures > Ceiling Light Fixtures, Nuvo Lighting, https://images.barcodelookup.com/6/68115-1.jpg, 1.7, 2 Light - 12" - Ceiling Fixture - Square Floral / w/Pull Chain.
029274007300, Knape & Vogt 80 Series 12 in. L White Adjustable Shelving Standard, Knape & Vogt, Hardware > Hardware Accessories > Brackets & Reinforcement Braces, Knape & Vogt, https://images.barcodelookup.com/6928/69280494-1.jpg, 1, The 80-series standard features a single slot design with 1 in. vertical slot adjustability. The single slot design allows a 180-series bracket (sold separately) to easily lock into the standard. Wall-mounted adjustable shelving standards are versatile...
039961060280, No Burst Fluidmaster 3/8 in. Comp X 7/8 in. Ballcock 12 in., Fluidmaster Inc, Hardware > Plumbing > Water Levelers, Fluidmaster Inc, https://images.barcodelookup.com/1403/14032302-1.jpg, 0.28lb, High-Strength Reinforced Vinyl Jacket  Toilet Connector  Tough Non-Toxic Core Resists Chlorine and  Chloramines  Extra Long Stainless Ferrules with Radial Crimp  Nickel Plated Brass Hex Nuts  3/8" Compression x 7/8" Ballcock12" Length.
071691152866, Rubbermaid DuraBull 12-1/2-by-5-1/4-by-7-Inch Toolbox #774000, , Hardware > Tools > Grinders, , https://images.barcodelookup.com/5234/52344081-1.jpg, , 
028452102257, GREAT NECK Combination Squares, 12", Great Neck Saw, Office Supplies > General Office Supplies > Paper Products > Binder Paper, Great Neck Saw, https://images.barcodelookup.com/2662/26624113-1.jpg, 7.14lb, Ysk1038:.
049448400003, 400 Zinc Combination Square, 12-in. - Quantity 1, Johnson Level & Tool, Home & Garden > Lawn & Garden > Gardening > Gardening Tools > Bulb Planting Tools, Johnson Level & Tool, https://images.barcodelookup.com/1362/13629292-1.jpg, 0.7, 12" Zinc Combination Square, Cast Zinc Head With Computer Machined Gauging Edges For Greater Accuracy, Acrylic Yellow Barrel Vial, Hardened, Removable Scriber, Steel Blade With Protective Anti Rust Coating Is Permanently Stamped In 1/8" and 1/32".
076174152654, Stanley Hand Tools 15-265 Rubber Grip Hacksaw, Stanley, Hardware > Tool Accessories > Tool Blades > Saw Blades, Stanley, https://images.barcodelookup.com/1253/12536269-1.jpg, , Hand Saws.
031949312244, [Case of 12] AAF Flanders EZ Flow 24 in. W X 12 in. H X 1 in. D Fiberglass 4 MERV Air Filter, Flanders Corp, Home & Garden > Kitchen & Dining > Kitchen Tools & Utensils > Cooling Racks, Flanders Corp, https://images.barcodelookup.com/1395/13955538-1.jpg, 4.15lb, AAF Flanders EZ Flow 24 in. W x 12 in. H x 1 in. D Fiberglass 4 MERV Air Filter SOLD ASCase of 12 PRODUCT OVERVIEW The Flanders Flat Panel EZ Flow heavy duty air filter protects your HVAC system's crucial components to ensure sufficient air flow and allows your system to run at peak efficiency. It also protects your home or office against household fibers, dust and pollen. The Flanders Flat Panel EZ Flow heavy duty air filter is suitable for a wide variety of HVAC systems and holds a MERV (Minimum Efficiency Reporting Value) rating of 4, which means it is third-party certified to effectively reduce household dust and particle debris. MERV ratings provide a standard comparison of air filter performance. A higher MERV rating signifies greater efficiency and increased protection against airborne particles. Reduces common household dust and airborne particles. Uses a chipboard frame reinforced with a metal retainer for maximum heavy-duty durability. Available in almost any size to fit almost any household heating or cooling system. Easy to install and replace every 30 days. PRODUCT DETAILS Width: 24 in. Height: 12 in. Depth: 1 in. Filter Material: Fiberglass MERV Rating: 4 MERV Filters Dust/Lint Filters Pollen Filter Frame Material: Cardboard One -Sided Metal Support.
077680201256, AC Cable, Southwire, Electronics > Electronics Accessories > Cables > Network Cables, Afc Cable Systems, https://images.barcodelookup.com/5343/53431857-1.jpg, 530, Southwire 12/2 Steel Armored Cable - AC-90 steel armored cable is black striped color-coded. Flexible and efficient, no couplings or elbows needed. Copper conductors are THHN 90 degrees Celsius rated. 16AWG internal bonding wire and the outer armor form the grounding path. Anti-short bushings included. Permitted for branch circuits and feeders on both exposed and concealed work. Dry locations only. UL (Underwriter's Laboratories) listed. - Length: 25', Size: 12 AWG, Type: AC Cable, Number of Conductors: 2 Conductors, Conductor Material: Copper, Conductor Type: Armored, Jacket Material: Steel, UL Listed: Yes, Pkg Qty: 1, Package Type: Shrink Wrap
032886065187, Southwire 25 Ft. 12/2 Solid Steel Armored AC Cable, Southwire Retail Sales, Hardware > Power & Electrical Supplies > Electrical Wires & Cable, Southwire Retail Sales, https://images.barcodelookup.com/1444/14441049-1.jpg, 4.6, Southwire 25 ft. 12/2 Solid Steel Armored AC Cable PRODUCT OVERVIEW Southwire 12/2 steel armored cable AC-90 steel armored cable is black striped color-coded. Flexible and efficient, no couplings or elbows needed. Copper conductors are THHN 90 degree Celsius rated. 16AWG internal bonding wire and the outer armor form the grounding path. Anti-short bushings included. Permitted for branch circuits and feeders on both exposed and concealed work. Dry locations only. UL Underwriter's Laboratories listed. DURACLAD AC Steel Armored CableAluminum Cable600 VoltsFor Dry Locations OnlyFor branch, feeder, power, lighting, controlFor branch, feeder, power, lighting, control PRODUCT DETAILS Wire Length: 25 ft. Gauge/Conductors: 12/2 Stranded or Solid: Solid Cable or Wire Type: Steel Armored AC UL Listed Ground Material: Steel Amp Rating: 20 amps Number of Conductors: 2 Indoor or Outdoor: Indoor Voltage Rating: 600 volt Insulation Material: PVC: Thermoplastic Jacket Material: Steel Conductor Gauge: 16 Ga. Flame Retardant Conductor Material: Copper Direct Burial Temperature Rating: 90 Color: Black.
032886067402, Southwire 50 Ft. 12/3 Solid Steel Armored AC Cable, Southwire Retail Sales, Hardware > Power & Electrical Supplies > Electrical Wires & Cable, Southwire Retail Sales, https://images.barcodelookup.com/1510/15102554-1.jpg, 10.6, Southwire 50 ft. 12/3 Solid Steel Armored AC Cable PRODUCT OVERVIEW AC 90 steel armored cable is black striped color coded. Flexible and efficient, no couplings or elbows needed. Copper conductors are THHN 90 degree Celsius rated. 16AWG internal bonding wire and the outer armor form the grounding path. Anti short bushings included. Permitted for branch circuits and feeders on both exposed and concealed work. Dry locations only. Due to the fluctuation of the copper market, reserves the right to bill at the prices prevailing on date of shipment. Duraclad Ac Steel Armored CableAluminum Cable600 VoltsFor Dry Locations OnlyFor Branch, Feeder, Power, Lighting, ControlFor Branch, Feeder, Power, Lighting, Control PRODUCT DETAILS Wire Length: 50 ft. Gauge/Conductors: 12/3 Stranded or Solid: Solid Cable or Wire Type: Steel Armored AC Amp Rating: 20 amps Insulation Material: PVC: Thermoplastic Conductor Gauge: 12 Ga. Number of Conductors: 3 Direct Burial UL Listed Flame Retardant Indoor or Outdoor: Indoor Jacket Material: Steel Voltage Rating: 600 volt Wet Location Use: No Temperature Rating: 90 Color: Black Conductor Material: Copper Ground Material: Steel.
074972900125, Kc Professional 90112 12ft Monster Tape Measure, KC Professional, Hardware > Tools > Measuring Tools & Sensors > Rulers, KC Professional, https://images.barcodelookup.com/1069/10694730-1.jpg, , The 12ft Monster Tape Measure from KC Tools has a heavy-duty rubber-covered case to help prevent damage and has a palm-size comfort grip. The heavy-duty stainless steel belt clip keeps the measure at your side. The true zero blade hooks ensures you get a.3/4" width.Heavy-duty rubber-covered case.Palm-size comfort grip.Heavy-duty stainless steel belt clip.True 0-blade hooks.&#9888; <strong>WARNING:</strong> This product can expose you to chemicals including lead compounds and phthalate compounds, which are known to the state of California to cause cancer and birth defects or other reproductive harm. For more information go.
045923931734, Satco 93173 - 12' Black Coiled Extension Cord, Satco, Electronics > Communications > Telephony > Corded Phones, Satco, https://images.barcodelookup.com/5047/50471884-1.jpg, , Satco 12' - Black - Coiled - Polarized - 3 Outlet | Satco Extension Cord (93-173 93173).
045923931697, Satco 12 FT Coiled Extension Cord 13A 125V 1625W Max Green, Satco, Luggage & Bags > Backpacks, eBigValue, https://images.barcodelookup.com/5408/54089065-1.jpg, , Green 12FT Coiled (Extended) Extension Cords 1250W Rated.
045923931758, Satco 12 FT Coiled Extension Cord 13A 125V 1625W Max Yellow, Satco, Home & Garden > Lighting Accessories > Lamp Post Mounts, Satco Products Inc, https://images.barcodelookup.com/11501/115018878-1.jpg, , Yellow 12FT Coiled (Extended) Extension Cords 1250W Rated.
039800011633, [Case of 4] Energizer Eveready 6-Volt Zinc Carbon Lantern BatteryBulk, Energizer LLC, Electronics > Electronics Accessories > Power > Batteries > General Purpose Batteries, Energizer LLC, https://images.barcodelookup.com/438/4384768-1.jpg, 1864, Energizer Eveready 6-Volt Zinc Carbon Lantern BatteryBulk SOLD ASCase of 4 PRODUCT OVERVIEW The Eveready 6 volt Super Heavy Duty Lantern Battery provides power to lanterns and lights requiring 6 volt lantern batteries. High-impact leak-proof plastic shell. Mercury freeCoil spring terminalsPremium power at popular pricesExcellent leakage resistanceLasts longer that regular batteriesModerate to heavy drain with regular useHeavy duty 6 volt4F size PRODUCT DETAILS Battery Size: 6-Volt Battery Chemistry: Zinc Carbon Volts: 6 volt Battery Type: Zinc-Carbon.
071649376504, [Case of 5] Master Lock 3/4 in. H X 7/16 in. W X 3/4 in. L Brass Pin Cylinder Padlock, Master Lock Company LLC, Hardware > Locks & Keys > Locks & Latches, Master Lock Company LLC, https://images.barcodelookup.com/367/3676536-1.jpg, 0.1, Master Lock 3/4 in. H x 7/16 in. W x 3/4 in. L Brass Pin Cylinder Padlock SOLD ASCase of 5 PRODUCT OVERVIEW The Master Lock No. 120D solid brass padlock features a 3/4 inch (19 mm) wide solid brass lock body that is strong, durable and resists corrosion. The 5/32 inch (4 mm) diameter shackle is 7/16 inch (11 mm) long and made of steel, offering resistance to cutting and sawing. The limited lifetime warranty provides peace of mind from a brand you can trust. 3/4 inch (19 mm) wide solid brass body padlockStandard steel shackle3-pin cylinder PRODUCT DETAILS Height: 3/4 in. Width: 7/16 in. Length: 3/4 in. Lock Material: Brass Locking Mechanism: Pin Cylinder Keyed Alike: No Shackle Width: 3/8 in. Combination Type: Keyed Shackle Clearance: 1/4 in. Adjustable Shackle: No Key Material: Brass Rekeyable: No Shackle Height: 7/16 in. Shackle Diameter: 5/32 in. TSA Approved: No Resettable or Customized Combinations: No Color: Brass Wide solid brass body padlock Standard steel shackle 3-pin cylinder Key blank not RSC stocked.
043374044409, M-D Products 04440 42" X 62" Shrink & Seal Indoor Window Kits 3 Count, M-D Building Products, Hardware > Building Materials > Windows, Generic, https://images.barcodelookup.com/364/3648703-1.jpg, , Create a comfortable environment in your home with the M-D Products 04440 3-Count Shrink and Seal Window Kit. It creates a seal around your window or doorframe that stops air from entering. This shrink film window insulation kit includes transparent film and tape for easy assembly. It is designed for indoor use.
086876048438, Rubbermaid Commercial Slim Jim Waste Container, Plastic, 23 gal, Beige, , Home & Garden > Household Supplies > Waste Containment > Recycling Containers, Rubbermaid, https://images.barcodelookup.com/4416/44160549-1.jpg, , 
032076050016, Power Products 3537883 Ring Terminals, Yellow - Pack of 14, Power Products, Business & Industrial > Retail > Money Handling > Cash Register & POS Terminal Accessories > Credit Card Terminals, Power Products, https://images.barcodelookup.com/322/3223229-1.jpg, 5, Features Ring terminals vinyl insulated barrel Quick and reliable crimp-type wire connections Color-coded by wire gauge size Includes spade and ring terminals, disconnects, and bullet, butt & tap splices Rated at 600 volt max Pack of 14 Specifications Color: Yellow Wire Gauge: 12-10.
032076050108, Gardner Bender 0075069 Crimp Butt Splice, 12 - 10 AWG, 600V - Yellow, Gardner Bender, Business & Industrial > Retail > Money Handling > Cash Register & POS Terminal Accessories > Credit Card Terminals, Gardner Bender, https://images.barcodelookup.com/322/3223237-1.jpg, 94, If you are a gadget lover, our Electronics catalog is your dream destination. Choose from hundreds of gadgets and accessories to suit different uses and add some entertainment, facility and convenience to your life. Gardner Bender Butt Splice, Crimp, 12 - 10 AWG Conductor, Copper Conductor, 600 V, Yellow, 167 deg F, cULus Listed, For Easy Crimp Splicing Features Fully Insulated - Solderless Color/Wire Size: Yellow/12-10 Pack of 15 Crimp Butt Splice, 12 10 AWG, 600V Yellow Specifications Country Of Origin: Taiwan Dimension: 4.38" H x 2.13" W x 6.83" L Weight: 0.15 lbs.
070798121225, Dap 12122 33' Window Glazing Compound, White, 1-Qt. - Quantity 1, Dap, Home & Garden > Lighting > Lighting Fixtures > Wall Light Fixtures, Dap, https://images.barcodelookup.com/1479/14792713-1.jpg, 23.79lb, QT, White, 33 Glazing Compound, For Glazing Wood and Metal Sashes, Outlasts Ordinary Putty, Smooth and Ready Mixed, Excellent Weather Resistance, Knife Grade.
019744120004, Wagner 30002s Economy Heat Gun, Wagner, Hardware > Tools > Heat Guns, Wagner Spray Tech Corp, https://images.barcodelookup.com/4982/49820341-1.jpg, 250, HEAT GUN - Haning hook, dual heat selection, 10 AMPS, 4100 BTU'S detachable scraper blade. Specifications: Housing: Engineered high impact corrosion of heat resistant polymers. Wattage: 1200 watts on high, 650 watts on low. Operates on 110-120 VAC. Safety: Double insulated to minimize electrical risk. Heat output: Approximately 750deg.F on low. Weight Approximately 1.6 pounds. Uses: soften paint, caulking and putty for easier removal. Soften adhesives to help remove sticker and floor tiles, bend plastic pipes, shrink tubing for electrical work, shrink plastic film for wrapping or weatherproofing, and used to loosen rusted, bolt and fittings.
