barcode, name, brand, category, manufacturer, image, weight, description071555006243, My Helper Cotton Wet Mop Head, World And Main, Home & Garden > Household Supplies > Household Cleaning Supplies > Buckets, World And Main, https://images.barcodelookup.com/15040/150401803-1.jpg, , My Helper brand offers an extensive line of assorted household cleaning supplies, rope and twine, snow brushes and ice scrapers, clothes dryers, clotheslines, and accessories. With a variety of every-day items designed for convenience and ease of use, My Helper is the one-stop-shop brand. 100% cotton yarn. Machine washable. Comes in a net bag.
024721905840, 1/4 Hex Shank Screw Pilot (Pack of 5), , Hardware > Tool Accessories > Drill & Screwdriver Accessories > Drill & Screwdriver Bits, Irwin Industrial Tool Co, https://images.barcodelookup.com/4407/44074816-1.jpg, , 
075352600543, Powers by DeWalt .003 in Dia Head Drive Pins with 1 in Washer - 50116-PWR, Dewalt, Hardware > Hardware Accessories > Hardware Fasteners > Screws, Dewalt, https://images.barcodelookup.com/3871/38714955-1.jpg, , Manufactured with a 0.145 in diameter shank in various length. Use to attach light gauge steel to concrete, concrete over steel deck, concrete masonry, or steel. Also used to attach wood members to concrete, concrete masonry, or steel. Provides sill plate anchorage.
076308009137, [Case of 6] Bondo Auto Body Filler 3/4 Oz., 3M Company, Hardware > Building Consumables > Hardware Glue & Adhesives, 3M Company, https://images.barcodelookup.com/111/1112778-1.jpg, 0.1, Bondo Auto Body Filler 3/4 oz. SOLD ASCase of 6 PRODUCT OVERVIEW Bondo red cream hardener is designed to be used with Bondo body fillers, Bondo-Glass, Bondo-Hair and fiberglass resin jelly. Formulated and packaged under temperature-controlled conditions which assures freshness and maximum performance. Formulated and packaged under controlled conditionsFor use during stage 2 and 3 of the 3M body repair systemMade of the highest quality raw materials for consistent performanceRed cream hardener for use with all fillers, putties and glazes PRODUCT DETAILS Container Size: 3/4 oz. Compatible Body Material: For hardening bondo body fillers Color: Red.
075339088302, Red Devil 0883 Kitchen & Bath Silicone Sealant, White, 2.8 Oz., Red Devil, Hardware > Building Consumables > Hardware Glue & Adhesives, Red Devil, https://images.barcodelookup.com/322/3224411-1.jpg, 0.01lb, Red Devil Kitchen & Bath Silicone Sealant, White, 2.8 Oz, Provides flexibility and adhesion to ensure a protective barrier against moisture and mildew.
010284124163, Mohawk Finishing Products Oz Cream Polish - 32oz, , Health & Beauty > Jewelry Cleaning & Care > Jewelry Cleaning Solutions & Polishes, Mohawk Finishing Products, https://images.barcodelookup.com/4877/48773465-1.jpg, , Ozreg; polish provides furniture with an anti-static agent for less dusting, along with an ultraviolet light absorber to help minimize fading. this ldquo;all in onerdquo; furniture polish cleans, polishes, and protects in one easy step without leaving a greasy mess. ozreg; polish does more and goes further.SKU:ADIB004NQDUQ8.
047719003045, Zinsser Bulls Eye Clear Shellac Finish and Sealer 1 Qt., Zinsser, Hardware > Building Consumables > Painting Consumables > Stains, Zinsser, https://images.barcodelookup.com/324/3249742-1.jpg, 2.2, Bulls-Eye Shellac is a shellac-based sealer that is designed to give wood a natural looking, mid-gloss finish that will not yellow or darken with age. Bulls-Eye Shellac is recommended for application to interior walls, doors, trim, cabinets, furniture and related paintable surfaces. It is suitable for use on new and previously painted drywall, cured plaster, wood pine, fir, cedar, redwood, plywood, metal and cured masonry stucco, concrete block, poured concrete, brick.
022384006300, [Case of 5] Shur-Line Refill 9 in. W Paint Pad for Flat Surfaces 1883441, Paint Brushes Shur, Hardware > Building Consumables > Painting Consumables > Paint, Paint Brushes Shur, https://images.barcodelookup.com/1494/14948782-1.jpg, 0.2, Shur-Line Refill 9 in. W Paint Pad For Flat Surfaces 1883441 SOLD ASCase of 5 PRODUCT OVERVIEW Refill for the Shur-Line 9" Pad Painter. For easy application of paints, stains, sealers and waxes. This thick foam pad contours to rough surfaces and flat surfaces for smooth painting on shakes, shingles, siding, walls, floors and more. Ideal for interior and exterior use; 9 in- Pad Painter leaves virtually zero lint behind! Thick foam pad contours to rough surfacesProvides smooth painting on shakes, shingles, siding, walls, floors and moreLeaves virtually zero lint behind! Easily apply paints, stains, sealers and waxesIdeal for interior and exterior use PRODUCT DETAILS Refill Width: 9 in. Recommended Surface: Flat Surfaces Material: Flocked Foam Thickness: .67 in. Length: 3.75 in.
022384007406, SHUR-LINE 2006649 Paint Pad,7 in. X 3-3/4 in, Plastic, Red, Shur-Line, Hardware > Tools > Paint Tools > Paint Sprayers, Shur-Line, https://images.barcodelookup.com/322/3225886-1.jpg, 3.47lb, Applicator, Length 3-3/4 In, Width 7 In, Construction Plastic, Red, For Use With Mfr Model No. 610C, Includes Comfort Grip Handle and Beveled Pad. This item has been restricted from sale in the following state(s): [].
047719009016, 1 Gal. White Alcohol Primer, ZINSSER, Hardware > Building Consumables > Painting Consumables > Stains, ZINSSER, https://images.barcodelookup.com/322/3229256-1.jpg, 37.29lb, Here are some important details for Zinsser Primer/Sealer Stain Killer. Color:  White, Size:  1 gal., Paint Color Family:  Whites.
047719009047, Rustoleum B-I-N Shellac Base Primer & Sealer Stain Killer 00904, Zinsser, Hardware > Building Consumables > Painting Consumables > Primers, Zinsser, https://images.barcodelookup.com/322/3229257-1.jpg, 4.42lb, <li>Absolutely the best interior wood sealer                                                                                                                                                                                                                  <li>Seals knots and sap streaks inside and out                                                                                                                                                                                                                <li>Seals pet, smoke, and musty odors                                                                                                                                                                                                                         <li>Seals water, smoke, graffiti, and grease stains                                                                                                                                                                                                           <li>Sticks to all surfaces without sanding                                                                                                                                                                                                                    <li>Lightening fast dry, re-coat in 45 minutes                                                                                                                                                                                                                <li>Quart                                                                                                                                                                                                                                                     <li>Length: 7<li>Width: 4<li>Height: 4.
047034023018, Trimaco 02301 Paper/plast Drop Cloth, 9' X 12', Trimaco, Hardware > Building Consumables > Protective Coatings & Sealants, Trimaco, https://images.barcodelookup.com/325/3259475-1.jpg, 0.88, Size: 9'x12', Paper/Plastic drop cloth, Paper top absorbs spills, Plastic backing prevents soak through, No clean-up necessary - just throw away.
047404310038, Equity by La Crosse 31003 Small Digital Alarm Clock, Equity, Home & Garden > Business & Home Security > Home Alarm Systems, Equity, https://images.barcodelookup.com/2208/22084478-1.jpg, 4.52lb, One battery powers this LCD digital alarm clock from La Crosse. This alarm is simple to operate and has a four-minute snooze duration. Be sure to wake up on time when you use this digital alarm clock from La Crosse. Featuring a black case and a bright LCD time display with white backlight, this clock leaves no excuse for misreading the exact time. The beeping alarm ensures you never miss an important appointment again. Plus, with its battery operation (requires one AA -not included) it?s completely portable for on-the-go or constant traveling.
044600024509, Clorox Ultra Bleach Pack of 12, Clorox, Home & Garden > Household Supplies > Laundry Supplies > Laundry Detergent, Clorox, https://images.barcodelookup.com/4492/44921696-1.jpg, 100, It has improved whitening formula. New Ultra Clorox Bleach gets whites even whiter than before. Now use 3/4 cup instead of 1 cup for all your laundry needs. Just as safe on fabrics as before. Small bottle is easy to handle, pour and store.
044600024523, 1-Clorox Concentrated Ultra Bleach (3 quart bottle 96 fl oz), Clorox, Home & Garden > Household Supplies > Laundry Supplies > Laundry Detergent, Clorox, https://images.barcodelookup.com/4880/48803525-1.jpg, 748, Whitening formula. Ultra Clorox Bleach gets whites even whiter than before. Now use 3/4 cup instead of 1 cup for all your laundry needs. Just as safe on fabrics as before. Small bottle is easy to handle, pour and store.
051131034587, 3M 03458 Reflective Tape, Red, 1" X 36", 3M, Hardware > Building Consumables > Hardware Tape, 3M, https://images.barcodelookup.com/111/1113037-1.jpg, 16, 3M Scotchlite Reflective Tape is visibility/identification tape for enhanced nighttime reflective brightness.
044600038025, Clorox #03802 44OZ Clorox2 Liquid Bleach, , Home & Garden > Household Supplies > Laundry Supplies > Laundry Detergent, Clorox Company, The, https://images.barcodelookup.com/5104/51042540-1.jpg, , 
070848008414, Columbian Home Prod. Turkey Lifters H00841-10C, HIC, Food, Beverages & Tobacco > Food Items > Meat, Seafood & Eggs > Meat > Canned Meats, HIC, https://images.barcodelookup.com/3462/34620485-1.jpg, , Heuck Trky Lftr.
045923038426, Bulb,Incandescent,40W,G16 1/2,Medium Base,Globe Light, SATCO, Home & Garden > Lighting > Light Bulbs > LED Light Bulbs, SATCO, https://images.barcodelookup.com/1246/12468631-1.jpg, , 40 Watt G16 1/2 Incandescent - Gloss White - 1500 Average Rated Hours - 330 Lumens - Medium Base - 120 Volts.
022384049352, 4935C 4 in. Fabric Roller Cover Refill, Shur-Line, Home & Garden > Household Supplies > Shoe Care & Tools > Shoe Brushes, Shur-Line, https://images.barcodelookup.com/322/3225897-1.jpg, , <li>Replacement fabric cover for paint rollers <li>For use on semi-smooth surfaces <li>4" <li>2 per card <li>Length: 4<li>Width: 1.13<li>Height: 6.
022384049406, [Case of 5 Packs] Shur-Line Foam 4 in. W Mini Paint Roller Cover 2006694 (2 per Pack), Nova Wildcat Shur-Line LLC, Home & Garden > Household Supplies > Laundry Supplies > Lint Rollers, Nova Wildcat Shur-Line LLC, https://images.barcodelookup.com/322/3225898-1.jpg, 0.1, Shur-Line Foam 4 in. W Mini Paint Roller Cover 2006694 SOLD ASCase of 5 packs (2 per pack) PRODUCT OVERVIEW High density foam provides an ultra smooth finish with minimal stippling and bubbling. Foam rollers also take in a larger volume of paint than a traditional roller making them well suited to large surface areas. Extremely useful on smooth surfaces where the roller can glide along and dispense paint such as on doors, cupboards, shelves, jambs, window frames, furniture and more. Delivers smooth finish, ideal for cabinets and doorsCovered roller end paints corners and wall4 in roller fits directly into a gallon paint canProvides long lasting use PRODUCT DETAILS Nap Material: Foam Width: 4 in. Roller Type: Mini Shed Resistant Use with Paint Type: All Paints & Stains Solvent Resistant Core Core Diameter: .25 in. Color: White Recommended Surface: Semi-SmoothWHAT'S INCLUDED: 2 - Shur-Line branded 4" foam mini rollers.
022384049505, [Case of 3 Packs] Shur-Line Foam 3/8 in. X 6 in. W Mini Paint Roller Cover (2 per Pack), Nova Wildcat Shur-Line LLC, Hardware > Tools > Paint Tools > Paint Rollers, Nova Wildcat Shur-Line LLC, https://images.barcodelookup.com/322/3229796-1.jpg, 0.1, Shur-Line Foam 3/8 in. x 6 in. W Mini Paint Roller Cover SOLD ASCase of 3 packs (2 per pack) PRODUCT OVERVIEW High density foam provides an ultra smooth finish with minimal stippling and bubbling. Foam rollers also take in a larger volume of paint than a traditional roller making them well suited to large surface areas. Extremely useful on smooth surfaces where the roller can glide along and dispense paint such as on doors, cupboards, shelves, jambs, window frames, furniture and more. Delivers smooth finish, ideal for cabinets and doorsCovered roller end paints corners and wallProvides long lasting use PRODUCT DETAILS Nap Material: Foam Width: 6 in. Roller Type: Mini Use with Paint Type: All Paints & Stains Recommended Surface: Semi-Smooth Application Type: Cabinets and Doors Solvent Resistant Core Color: White SurfApplication: Semi-Smooth Core Diameter: .25 in. Roller Cover Width: 6 in. Roller Size: Mini Shed Resistant WHAT'S INCLUDED: 2 - Shur-Line branded 6" foam mini rollers.
079423062209, Hyde 06220 Maxxgrip Hammerhead Putty Knife, 2", , Hardware > Tools > Tool Knives, Hyde Tools Inc, https://images.barcodelookup.com/5588/55886499-1.jpg, , 
022384066151, SHUR-LINE 6615C Mini Paint Roller Frame, Frame, Wire, Shur-Line, Hardware > Tools > Paint Tools > Paint Rollers, Shur-Line, https://images.barcodelookup.com/1559/15590618-1.jpg, 0.3, Mini Paint Roller Frame, Roller Length 4 and 6 In, Frame Style, Overall Length 12-1/2 In, All Surfaces, Wire Handle, Handle Material Plastic, Shank Wire Size 1/4 In, Shank Material Steel, Chrome Plating, Paint Type Water and Oil Based, Comfort Grip. This item has been restricted from sale in the following state(s): [].
022384066250, SHUR-LINE 6625C Mini Paint Roller Frame,16in.L,Steel, Shur-Line, Hardware > Tools > Paint Tools > Paint Rollers, Shur-Line, https://images.barcodelookup.com/1404/14043028-1.jpg, 0.3, Mini Paint Roller Frame, Roller Length 4 and 6 In, Frame Style, Overall Length 16-1/2 In, All Surfaces, Wire Handle, Handle Material Plastic, Shank Wire Size 1/4 In, Shank Material Steel, Chrome Plating, Paint Type Water and Oil Based, Comfort Grip. This item has been restricted from sale in the following state(s): [].
077922893034, Intertape 9975 Double-Sided Outdoor Carpet Tape: 2 in. X 15 Ft. (Black), Intertape Polymer Group, Hardware > Building Consumables > Hardware Tape, Intertape Polymer Group, https://images.barcodelookup.com/1104/11046115-1.jpg, , Intertape 9975 Double-Sided Outdoor Carpet Tape is a heavy-duty double-sided black cloth tape on a white film release liner. Core: 3 inch diameter Backing/Carrier: heavy-duty cotton cloth.
019442176914, Reducer,Black 1-1/2x1", , Apparel & Accessories > Clothing > Traditional & Ceremonial Clothing > Japanese Black Formal Wear, , https://images.barcodelookup.com/4982/49820383-1.jpg, , Reducer,Black 1-1/2x1".
049448080007, Johnson Level 08 8 Oz. Steel Hexagonal Plumb Bob, Johnson Level, Hardware > Hardware Accessories > Hardware Fasteners > Screws, Johnson Level, https://images.barcodelookup.com/1386/13861802-1.jpg, 0.55, Features Hexagonal machined steel body Corrosion resistant plated finish Removable cap for easy, centered string installation 8 oz. Steel hexagonal plumb bob Dimension - 0.75 x 3.25 x 7.38 in. Item weight - 0.55 lbs.
087115009319, BWF 931-1 Lampholder Cover, Round, Metal, for 1-1/2 in Outlet Box 6 Pack, Teddico/Bwf, Hardware > Building Materials, Teddico/Bwf, https://images.barcodelookup.com/2689/26892221-1.jpg, 0.01lb, BWF 931-1 Lampholder Cover, Round, Metal, For 1-1/2 in Outlet Box 6 Pack.
087115009333, BWF 933-1 Lampholder Cover, Round, Metal, for 3-1/2 in Outlet Box 6 Pack, Teddico/Bwf, Hardware > Building Materials, Teddico/Bwf, https://images.barcodelookup.com/2689/26892102-1.jpg, 0.01lb, BWF 933-1 Lampholder Cover, Round, Metal, For 3-1/2 in Outlet Box 6 Pack.
020418180354, 1/4-in Zinc-Plated Quick-Link Chain, Blue Hawk, Media > Books > Print Books, Blue Hawk, https://images.barcodelookup.com/1809/18091231-1.jpg, , <p>1/4-in Zinc-Plated Quick-Link Chain</p>  <ul>  <li>Used for quick connections to low carbon chains</li>  <li>Medium-duty</li> </ul>.
032076894160, Electrical 1/4"Es Coaxial Cable Wood Staples Gardner Bender Staples PSW-1650, GB Electrical, Hardware > Power & Electrical Supplies > Electrical Motors, GB Electrical, https://images.barcodelookup.com/1187/11875777-1.jpg, , Electrical 1/4"es coaxial cable wood staples UPC: 032076894160.
038728411020, General Tools 1/2 in. Solid-Brass Grommet Kit, , Hardware > Tools > Grinders, General Tools, https://images.barcodelookup.com/4527/45273215-1.jpg, 0.71, General Tools specializes in bringing customers with high quality, specialty items for jobs of all types. The General Tools 1/4 in. Grommet Kit includes a hardened-steel hole cutter, a matched mandrel/anvil pair, a hardwood backer block and an assortment of grommets - everything you'll need for repairing or adding grommets to tarps, tents, awnings and pool covers.
042526611322, [Case of 3] Irwin 1/2 in. X 4 in. L Carbide Tipped Rotary Drill Bit, Black & Decker Us Inc, Hardware > Tool Accessories > Router Accessories > Router Bits, Black & Decker Us Inc, https://images.barcodelookup.com/1322/13224813-1.jpg, 0.1, Irwin 1/2 in. x 4 in. L Carbide Tipped Rotary Drill Bit SOLD ASCase of 3 PRODUCT OVERVIEW Shot-peened, double tempered finish reduces breaka Made of shock-resistant and heat treated S2 steel for maximum strength and hardnessTungsten carbide tip for durability in concrete and brick. Deep single flute removes drilling dust fast. PRODUCT DETAILS Diameter: 1/2 in. Overall Length: 4 in. Material: Carbide Tipped Finish: Zinc Shank Type: Straight Shank Usage: Drilling concrete and brick Economy rotary carbide-tipped All purpose for DIYers Zinc finish Fast spiral flute.
032888080034, B & K 108-003 Brass Sillcock, 1/2", B & K, Home & Garden > Lawn & Garden > Gardening > Gardening Tools > Bulb Planting Tools, B & K, https://images.barcodelookup.com/1526/15269428-1.jpg, 0.5, Indoor/outdoor. 3/4" hose thread outlet. Six-point cast-iron handle. Oversized notched flange. Threaded ends comply with ANSI B1.20.1.
076174163087, STANLEY 16-308 Bi-Material Short Blade Wood Chisel - 1/2", Stanley Consumer Tools, Hardware > Tools > Pliers, Stanley Consumer Tools, https://images.barcodelookup.com/1256/12569222-1.jpg, 0.5, Short Blade Chisel. This item has been restricted from sale in the following state(s): [].
045325133071, [Case of 3] Vermont American 1/2 in. X 3-3/4 in. L Carbide Glass and Tile Bit, Robert Bosch Tool Corp, Hardware > Tool Accessories > Drill & Screwdriver Accessories > Drill & Screwdriver Bits, Robert Bosch Tool Corp, https://images.barcodelookup.com/1313/13133920-1.jpg, 0.1, Vermont American 1/2 in. x 3-3/4 in. L Carbide Glass and Tile Bit SOLD ASCase of 3 PRODUCT OVERVIEW Glass and tile drill bits provide smooth, accurate drilling in ceramic tile, marble, china, mirrors and glass. The spear-pointed tip design reduces breakout and the bit features a carbide tip for extended bit life. These bits are ideal for drilling fastener holes in bathroom tile or wall mirrors. Smooth accurate drilling in glass, tile, marble, china and mirrorsSpear-pointed tip design reduces breakoutIdeal for drilling fastener holes in bathroom tile or wall mirrorsCarbide-tipped for long lifeFits drills with 3/8 in. or larger chucks1/2 in. diameter3-3/4 in. overall length PRODUCT DETAILS Diameter: 1/2 in. Overall Length: 3-3/4 in. Material: Carbide Usage: Mirrors or Glass Shank Type: Straight Shank.
020418179723, [Case of 10] Campbell Chain 1/2 in. Dia. X 2-11/16 in. L Nickel-Plated Zinc Trigger Snap 40 Lb., Apex Tool Group LLC, Food, Beverages & Tobacco > Food Items > Nuts & Seeds, Apex Tool Group LLC, https://images.barcodelookup.com/1167/11679645-1.jpg, 160, Campbell Chain 1/2 in. Dia. x 2-11/16 in. L Nickel-Plated Zinc Trigger Snap 40 lb. SOLD ASCase of 10 PRODUCT OVERVIEW Round eye trigger snap is ideal for pet leashes and tie-outs. Typical uses include tarp covers, key rings, gate closures, flagpoles, and other home, farm, recreational and marine Nickel platedSwiveling1/2 inch eye PRODUCT DETAILS Eye Diameter: 1/2 in. Length: 2-11/16 in. Finish: Nickel-Plated Material: Zinc Working Load: 40 lb. 3/8" opening.
032076019303, GARDNER BENDER 930B Hand Bender,1/2" EMT, Aluminum, GARDNER BENDER, Hardware > Plumbing > Plumbing Pipes, GARDNER BENDER, https://images.barcodelookup.com/1223/12235554-1.jpg, 1.65, Gardner Bender's EMT Aluminum Hand Bender Bends 1/2" EMT conduit. The built-in acrylic level gauge helps make precise bends in half the time. Includes embossed sight lines for 10 deg, 22.5 deg, 30 deg, 45 deg, 60 deg and 90 deg bends. The patented Vise-Mate holds conduit steady as it is cut to the appropriate size. This item has been restricted from sale in the following state(s): [].
032076660505, GARDNER BENDER PS-50 Cable Staple,1/2In, Plastic, Romex, Pk50, Gardner Bender, Hardware > Tools > Measuring Tools & Sensors > Electrical Testing Tools, Gardner Bender, https://images.barcodelookup.com/320/3203764-1.jpg, 0.12, Cable Staple, Size 1/2 In, Color White, Material UV-Resistant Plastic Saddle with Nails, For Wire/Cable Type Romex, UF, and Other NM Cable, Wood For Use On, Package Quantity 50. This item has been restricted from sale in the following state(s): [].
039003091173, 9117 4 Count .5 in. White Rubber Leg Tips, Shepherd, Luggage & Bags > Fanny Packs, Shepherd, https://images.barcodelookup.com/1581/15816200-1.jpg, , <li>Rubber tips <li>1/2" <li>White <li>4 per card <li>Length: 1.38<li>Width: 3.63<li>Height: 4.56.
077578024295, FROST KING C22H Weatherstrip,20 Ft, Gray, Thermwell, Hardware > Tools > Caulking Tools, Thermwell, https://images.barcodelookup.com/1115/11153420-1.jpg, 0.1, Weatherstrip, Insert Material Poly Foam, Insert Color Gray, Overall Length 20 ft, Stays Flexible to 10 Degrees to 140 Degrees F, Mounting Type Adhesive, Sold As Roll. This item has been restricted from sale in the following state(s): [].
037459111674, U-Bolt Fits 1/2" Pipe, , Hardware > Tools > Cutters > Bolt Cutters, Hindley Manufacturing, https://images.barcodelookup.com/4981/49817991-1.jpg, , 
020066778071, Rustoleum Half Pint White Primer Stops Rust Clean Metal Primer  7780-730, Zinsser, Hardware > Building Consumables > Painting Consumables > Primers, Zinsser, https://images.barcodelookup.com/1327/13278772-1.jpg, 0.44lb, <li>Clean metal primer                                                                                                                                                                                                                                        <li>Provides rust protection to clean or lightly rusted metal                                                                                                                                                                                                 <li>Apply directly over rust to allow superb adhesion for finishes                                                                                                                                                                                            <li>Works with bare or previously painted metal                                                                                                                                                                                                               <li>Indoor and outdoor                                                                                                                                                                                                                                        <li>Durable and corrosion resistant                                                                                                                                                                                                                           <li>White                                                                                                                                                                                                                                                     <li>Half pint                                                                                                                                                                                                                                                 <li>Carded                                                                                                                                                                                                                                                    <li>Length: 1.5<li>Width: 0.58<li>Height: 1.02.
