051643060142, [Case of 20] Keeper Assorted Bungee Cord3 in. L X 0.315 in., Hampton Products International Corp, Hardware > Building Materials > Door Hardware > Door Bells & Chimes, Hampton Products International Corp, https://images.barcodelookup.com/1580/15807014-1.jpg, 0.65, Keeper Assorted Bungee Cord3 in. L x 0.315 in. SOLD ASCase of 20 PRODUCT OVERVIEW Keeper 13 inch Bungee Cords are made from the highest quality materials for long-lasting dependability no matter what the application. All Keeper bungee cords are designed to withstand UV rays and weather damage with durable outer jackets in bright, visible colors. Inside, premium rubber ensures top quality performance and outstanding toughness. Heavy gauge steel hooks at both ends are coated with a protective vinyl covering, which prevents rust and ensures that hooks will never damage paint or scratch metal. Keeper Bungee Cords are strong enough to be relied on whenever they're needed. 13 inch bungee cordDependable vinyl coated steel hook won't mar paint and prevents rustDurable UV resistant outer jacket PRODUCT DETAILS Color: Assorted Length: 13 in. Thickness: 0.315 in. Weather Resistant Carabiner Included: No UV Protected Material: Rubber/Steel Hooks Multiple Sizes: No Premium grade long lasting rubber. Durable UV resistant out jacket. Vinyl coated heavy gauge steel hooks. 70 lb. hook capacity.
047719036081, William Zinsser Co Cover Stain Oil Base Primer/Sealer - All, Zinsser, Hardware > Building Consumables > Painting Consumables > Stains, Zinsser, https://images.barcodelookup.com/1079/10791231-1.jpg, 5.17lb, Pack Size 6 EA COVER STAIN OIL BASE PRIMER/SEALER All purpose primer/sealer bond coat Best exterior sealer Seals cedar/redwood bleed Seals water, smoke, nicotine graffiti stains Sticks to all surfaces without sanding Dries quickly, recoat in one hour Use under any water or oil base topcoat For interior or exterior surfaces 03608 SPRAY COVER STAIN SIZE 13 Oz. Spray COLOR Flat White.
070048713224, Homax GT22 Tile and Grout Magic, 13-Ounce Aerosol, , Home & Garden > Household Supplies > Household Cleaning Supplies > Household Cleaning Products > Tub & Tile Cleaners, Homax, https://images.barcodelookup.com/4993/49937273-1.jpg, , TILE & GROUT MAGIC - Even the dirtiest, stained grout lines between tile are cleaned quickly with this disinfectant formula. Foams on to brighten color. Removes even subsurface grime, hard water stains, mold, and mildew. Safe on all tile and porcelain. No harsh adrasives or caustic acids to scratch. mar or dull fixtures.
076174517132, Nail Hammer, High Carbon Steel Head, Hickory Handle, 13 in, 1.42 Lb, Stanley® Products, Hardware > Tools > Hammers > Manual Hammers, Stanley® Products, https://images.barcodelookup.com/1287/12872776-1.jpg, 5.65lb, Stanley® Wood Handle Nail Hammers Fully heat treated and polished bell face. Forged high-carbon steel head. Exclusive rim temper reduces incidences of chipping or spalling Pack of 1.
046135202841, Bulb,CFL,13W,T4,2GX7 (4-Pin) Base,Single Twin 4 Pin, SYLVANIA, Home & Garden > Lighting > Light Bulbs > LED Light Bulbs, SYLVANIA, https://images.barcodelookup.com/1237/12374517-1.jpg, , 13 Watt - Pin-Based Compact Fluorescent - 3000K - 82 CRI - 2GX7 (4-Pin) Base.
043168975940, GE 97594 Double Biax Compact Fluorescent Light Bulb, 13 Watts, GE, Home & Garden > Lighting > Light Bulbs > LED Light Bulbs, GE, https://images.barcodelookup.com/432/4323497-1.jpg, 1.5, The high quality double tube emits beautiful warm white 2700K color temperature. Ideal for facilities, retail displays, hospitality, office, restaurant, and warehouse applications.
046135208911, SYLVANIA S4369 Bulb, CFL,13W,T4, GX24q-1 (4-Pin) Base, Triple Twin 4 Pin, SYLVANIA, Home & Garden > Lighting > Light Bulbs > LED Light Bulbs, SYLVANIA, https://images.barcodelookup.com/1144/11443110-1.jpg, 1, California Proposition 65: This product contains a chemical known to the State of California to cause cancer. California Proposition 65: This product contains a chemical known to the State of California to cause birth defects or other reproductive harm.13 Watt - Pin-Based Compact Fluorescent - 2700K - 82 CRI - GX24q-1 (4-Pin) Base. This item has been restricted from sale in the following state(s): [].
045923073649, Bulb,CFL,13W,T2,Candelabra Base,Spirals CFL, SATCO, Home & Garden > Lighting > Light Bulbs > LED Light Bulbs, SATCO, https://images.barcodelookup.com/372/3724882-1.jpg, , Bulb,CFL,13W,T2,Candelabra Base,Spirals.
046135204845, Bulb Fluo 2pn 1tbe Swht G23 9w, Sylvania, Home & Garden > Lighting > Light Bulbs > LED Light Bulbs, Sylvania, https://images.barcodelookup.com/1200/12008909-1.jpg, , Bulb Fluo 2pn 1tbe Swht G23 9w.
046135204913, Bulb Fluo 2pn 1tbe T4 Swht 13w, Sylvania, Home & Garden > Lighting > Light Bulbs > LED Light Bulbs, Sylvania Lighting, https://images.barcodelookup.com/1222/12222545-1.jpg, , Bulb Fluo 2pn 1tbe T4 Swht 13w.
046135211348, Sylvania CF13DS/841/ECO 13W GX23 Compact Fluorescent Light Bulb, SYLVANIA, Home & Garden > Lighting > Light Bulbs > LED Light Bulbs, SYLVANIA, https://images.barcodelookup.com/1146/11465127-1.jpg, , Sylvania 21134 has an abbreviation name CF13DS/841/ECO. This bulb is a single compact fluorescent that has a 4100K color temperature. It is a 13 watt bulb, has a rated life of 10000 hours and a GX23 base. The SYLVANIA 21134 bulb is for general lighting.
076812009395, Great Neck PW14 14" Pipe Wrenches (Wrench), Great Neck, Hardware > Tools > Wrenches, Great Neck, https://images.barcodelookup.com/110/1108511-1.jpg, 1.32lb, Great Neck PW14 14" Pipe Wrenches (Wrench). Quality steel Precision, movable jaws Perfect balance For the professional or do-it-yourselfer 14" Material: Metal Color: Multi.
074972970845, KC Professional, 97084, 100 Pack, 14" White Natural Cable Tie, Nylon, 50 LB Tensile Strength, , Hardware > Hardware Accessories > Hardware Fasteners > Screws, KC Pro Tools, https://images.barcodelookup.com/1309/13092908-1.jpg, , KC Professional, 97084, 100 Pack, 14" White Natural Cable Tie, Nylon, 50 LB Tensile Strength.
076812014481, Great Neck C5 Bench-Jack Planes 14-Inch Plane 2-Inch Cutter, , Hardware > Tools > Pliers, Great Neck Saw, https://images.barcodelookup.com/4676/46762314-1.jpg, , <b>Plane</b><br><br>Alloy tool steel cutters, razor-sharp, fully adjustable. Lever cap reduces weight, adds longer life. Bottom and sides machined and polished. Rigid construction and vibration-proof. Screw adjusts for different cuts. 2 IN cutter.<p><b>No. C4:</b> Bench plane, 9 IN frame<br><b>No. C5:</b> Jack plane, 14 IN frame<p><b>Your are ordering Part # C5</b>
024721001832, Irwin Industrial 6In 14Tpi Reciprocating Blade 372614, Irwin Industrial, Hardware > Tool Accessories > Drill & Screwdriver Accessories > Drill & Screwdriver Bits, Irwin Industrial, https://images.barcodelookup.com/1528/15281182-1.jpg, , Electronic beam weld allows for a more powerful bond. Bi-Metal blade increases blade life. Applications - Cuts all metals including non-ferrous, pipe, conduit, stainless and sheet metal. Features Bi-metal - Metal Teeth Per - 14 in. Length - 6 in.
045923779909, NUVO SF77-990 2 Light 14 in. Vanity White in. U in. Channel Glass Conv Out, NUVO, Home & Garden > Lighting > Lighting Fixtures > Ceiling Light Fixtures, NUVO, https://images.barcodelookup.com/6/68166-1.jpg, 10.43, 2 Light - 14" - Vanity - with White "U" Channel Glass with Conv Outlet Features Frosted Glass 2 A19 60w Incandescent Finish - WhiteStyle - TraditionalBulb Type - IncandescentDimension String - W:14" H:4 3/4" E:4 1/4"Bulb Shape - A19Shade Size String - shade(s) 1 - White GlassBulb Included - No. This item has been restricted from sale in the following state(s): [].
074972922141, KC Professional's 14" Backsaw Hardwood Handle w/Rubber Grip, , Home & Garden > Decor > Door Mats, KC Professional, https://images.barcodelookup.com/4676/46769863-1.jpg, , 
076174155099, Stanley 15-509 14-Inch Blade 13 Points Per Inch Back Saw, , Hardware > Tool Accessories > Tool Blades > Saw Blades, Stanley, https://images.barcodelookup.com/1298/12983884-1.jpg, , 
074972925319, KC Professional 92531 14" Bolt Cutters, World And Main, Hardware > Tool Accessories > Power Tool Batteries, World And Main, https://images.barcodelookup.com/15040/150401791-1.jpg, 1.64lb, KC Professional tools offers a full assortment of hand tools including chisels, pliers, hammers, axes, screwdrivers, power tapes, punches, hacksaws, knives, bolt cutters, masonry bits, pipe and adjustable wrenches, and wrecking bars. KC Professional tools are manufactured using state-of-the-art forging techniques, superior raw materials, and the finest machining processes available. Before we put the KC Pro stamp onto each tool, we make certain it is produced with the same pride of workmanship that existed years ago, assuring superior tool performance worth of the brand KC Professional tools.
045923762765, NUVO SF76-276 2 Light 14 in. Vanity Diamond in. U in. Channel Glass White, NUVO, Home & Garden > Lighting > Lighting Fixtures > Ceiling Light Fixtures, NUVO, https://images.barcodelookup.com/6/67808-1.jpg, 2.09, 2 Light - 14" - Vanity - with Diamond "U" Channel Glass Features Glass 2 A19 60w Incandescent Finish - WhiteStyle - TraditionalBulb Type - IncandescentDimension String - W:14" H:4 3/4" E:4 1/4"Bulb Shape - A19Shade Size String - shade(s) 1 - White Diamond GlassBulb Included - No. This item has been restricted from sale in the following state(s): [].
045923325472, 1-Light 14-inch Flush Mounted LED Light Fixture - White Finish (White), Satco Products, Animals & Pet Supplies > Pet Supplies > Fish Supplies > Aquarium Lighting, Satco Products, https://images.barcodelookup.com/5/53189-1.jpg, , 1-Light 14-inch Flush Mounted LED Light Fixture - White Finish (White). 1-Light 14-inch Flush Mounted LED Light Fixture - White Finish Number of Light: 1 Light Light Bulb Type: LED Bulb Wattage: 18 W Shade Material: Acrylic Lighting Type: Flush Mounts Product Features: Bulbs Included, Energy Efficient Material: Acrylic Light Direction: Downlight Assembly: Assembled Setting: Indoor Ceiling Light Fixture Type: Flush mount Switch Type: Hardwired Lighting Style: Contemporary Exact Color: White Finish: White Finish Color: White <!--D/--><!--disc/--> This fixture needs to be hardwired. Professional installation is recommended. <!--/disc--><!--/D-->.
071497144225, WOOSTER RR013 Mini Roller Frame,12 in, Wooster Brush, Hardware > Tools > Paint Tools > Paint Rollers, Wooster Brush, https://images.barcodelookup.com/1415/14157501-1.jpg, 0.5, Mini Paint Roller Frame, Roller Length 4-1/2 and 6-1/2 In, Cage Style, Overall Length 12 In, Universal Threaded Handle, Handle Material Plastic, Shank Wire Size 1/4 In, Shank Material Steel, Chrome Plating, Paint Type All Paints, Solvent-Resistant Plastic Cage, Extra-Smooth Rolling Action, Chrome-Plated 1/4 In. Shank, Full-Size Polypropylene Grip with Reinforced Threads, Sherlock GT Compatible. This item has been restricted from sale in the following state(s): [].
045923722028, Satco S72-202, Satco, Sporting Goods > Athletics > Fencing > Fencing Protective Gear > Fencing Jackets & Lamés, Satco, https://images.barcodelookup.com/3040/30409259-1.jpg, , 14in Polished Brass Standard Picture Light w/Adjustable Bracket, line cord switch.
043374491944, M-D Building Products Cutter Tile Machine 14 Inch 49194, M-D Building Products, Arts & Entertainment > Hobbies & Creative Arts > Arts & Crafts > Art & Crafting Materials > Raw Candle Wax, M-D Building Products, https://images.barcodelookup.com/1385/13858067-1.jpg, 3.95lb, Features Straight cuts up to 14 in. tile Cast aluminum brackets and cutter assembly Replaceable cutting wheel Non-slip cutting area Polished rails.
031949314200, [Case of 12] AAF Flanders EZ Flow 20 in. W X 14 in. H X 1 in. D Fiberglass 4 MERV Air Filter, Flanders Corp, Home & Garden > Kitchen & Dining > Kitchen Tools & Utensils > Cooling Racks, Flanders Corp, https://images.barcodelookup.com/2651/26517345-1.jpg, 41.26lb, AAF Flanders EZ Flow 20 in. W x 14 in. H x 1 in. D Fiberglass 4 MERV Air Filter SOLD ASCase of 12 PRODUCT OVERVIEW The Flanders Flat Panel EZ Flow heavy duty air filter protects your HVAC system's crucial components to ensure sufficient air flow and allows your system to run at peak efficiency. It also protects your home or office against household fibers, dust and pollen. The Flanders Flat Panel EZ Flow heavy duty air filter is suitable for a wide variety of HVAC systems and holds a MERV (Minimum Efficiency Reporting Value) rating of 4, which means it is third-party certified to effectively reduce household dust and particle debris. MERV ratings provide a standard comparison of air filter performance. A higher MERV rating signifies greater efficiency and increased protection against airborne particles. Reduces common household dust and airborne particles. Uses a chipboard frame reinforced with a metal retainer for maximum heavy-duty durability. Available in almost any size to fit almost any household heating or cooling system. Easy to install and replace every 30 days. PRODUCT DETAILS Width: 20 in. Height: 14 in. Depth: 1 in. Filter Material: Fiberglass MERV Rating: 4 MERV Filter Frame Material: Cardboard Filters Dust/Lint Filters Pollen One -Sided Metal Support.
031949314248, [Case of 12] AAF Flanders EZ Flow 24 in. W X 14 in. H X 1 in. D Fiberglass 4 MERV Air Filter, Flanders Corp, Home & Garden > Kitchen & Dining > Kitchen Tools & Utensils > Cooling Racks, Flanders Corp, https://images.barcodelookup.com/1468/14682783-1.jpg, 6.61lb, AAF Flanders EZ Flow 24 in. W x 14 in. H x 1 in. D Fiberglass 4 MERV Air Filter SOLD ASCase of 12 PRODUCT OVERVIEW The Flanders Flat Panel EZ Flow heavy duty air filter protects your HVAC system's crucial components to ensure sufficient air flow and allows your system to run at peak efficiency. It also protects your home or office against household fibers, dust and pollen. The Flanders Flat Panel EZ Flow heavy duty air filter is suitable for a wide variety of HVAC systems and holds a MERV (Minimum Efficiency Reporting Value) rating of 4, which means it is third-party certified to effectively reduce household dust and particle debris. MERV ratings provide a standard comparison of air filter performance. A higher MERV rating signifies greater efficiency and increased protection against airborne particles. Reduces common household dust and airborne particles. Uses a chipboard frame reinforced with a metal retainer for maximum heavy-duty durability. Available in almost any size to fit almost any household heating or cooling system. Easy to install and replace every 30 days. PRODUCT DETAILS Width: 24 in. Height: 14 in. Depth: 1 in. Filter Material: Fiberglass MERV Rating: 4 MERV Filter Frame Material: Cardboard Filters Dust/Lint Filters Pollen One -Sided Metal Support.
031949314255, [Case of 12] AAF Flanders EZ Flow 14 in. W X 25 in. H X 1 in. D Fiberglass 4 MERV Air Filter, Flanders Corp, Home & Garden > Kitchen & Dining > Kitchen Tools & Utensils > Cooling Racks, Flanders Corp, https://images.barcodelookup.com/1841/18417890-1.jpg, 5.72lb, AAF Flanders EZ Flow 14 in. W x 25 in. H x 1 in. D Fiberglass 4 MERV Air Filter SOLD ASCase of 12 PRODUCT OVERVIEW The Flanders Flat Panel EZ Flow heavy duty air filter protects your HVAC system's crucial components to ensure sufficient air flow and allows your system to run at peak efficiency. It also protects your home or office against household fibers, dust and pollen. The Flanders Flat Panel EZ Flow heavy duty air filter is suitable for a wide variety of HVAC systems and holds a MERV (Minimum Efficiency Reporting Value) rating of 4, which means it is third-party certified to effectively reduce household dust and particle debris. MERV ratings provide a standard comparison of air filter performance. A higher MERV rating signifies greater efficiency and increased protection against airborne particles. Reduces common household dust and airborne particles. Uses a chipboard frame reinforced with a metal retainer for maximum heavy-duty durability. Available in almost any size to fit almost any household heating or cooling system. Easy to install and replace every 30 days. PRODUCT DETAILS Width: 25 in. Height: 14 in. Depth: 1 in. Filter Material: Fiberglass MERV Rating: 4 MERV Pleated: No Filters Dust/Lint Filter Frame Material: Cardboard Filters Pollen One -Sided Metal Support.
038753340562, 34056 14 X 14-Inch Access Door Panel - Quantity 1, Oatey, Home & Garden > Kitchen & Dining > Kitchen Appliance Accessories > Outdoor Grill Accessories, Oatey, https://images.barcodelookup.com/1526/15262445-1.jpg, 1.5, 14" x 14", Access Panel, Provides A Service Area For Plumbing, Electrical, Security Systems, Telephone, TV, Computer Cables and Sprinkler System Applications, Reversible, Can Be Flushed Mounted, Surface Mounted, Painted, Wallpapered Or Tiled To Match Any Decor, No Framing Required.
070042143362, Levolor 14336 Cafe Rod Brackets, Brass, Levolor, Hardware > Tools, Levolor, https://images.barcodelookup.com/1727/17277963-1.jpg, , With mounting hardware.
038613227262, National Hardware SPB518 3" Zinc Plated Non-Removable Pin Hinge, , Hardware > Hardware Accessories > Hinges, , https://images.barcodelookup.com/4739/47392676-1.jpg, , 
051643055148, Rtcht Tie Dwn 1x14 1800lb, HAMPTON PROD, Vehicles & Parts > Vehicle Parts & Accessories > Vehicle Maintenance, Care & Decor > Vehicle Covers > Vehicle Storage Covers > Automotive Storage Covers, HAMPTON PROD, https://images.barcodelookup.com/1445/14455807-1.jpg, 2.5, Cargo Tie Down; 14 Feet Length X 1 Inch Width; 500 Pound Load Capacity; 1500 Pound Break Strength; With Ratchet; Blue.
078143204456, [Case of 6] Devcon Home 5 Minute High Strength Epoxy 0.47 Oz., Itw Global Brands, Hardware > Building Consumables > Hardware Glue & Adhesives, Itw Global Brands, https://images.barcodelookup.com/1384/13845135-1.jpg, 1.00lb, Devcon Home 5 Minute High Strength Epoxy 0.47 oz. SOLD ASCase of 6 PRODUCT OVERVIEW A two part, rapid curing, clear, general purpose epoxy. Better on more rigid materials. Useful for repair of autos, bikes, boats and more. May also be used as a metal filler and to restore rotten wood. Apply mixed epoxy directly to your repair. The flow-mix nozzles automatically mixes resin and hardener together. Includes two precision self-mixing nozzles. Apply epoxy right where you need it without having to mixUse for automotive or household repairs and hobbiesWorks best on steel, concrete, fiberglass, glass, metal and rubber5 minute set timeSuper high strength, 1500 psiWaterproofIncludes two Insta-Mix nozzlesMade in USAContains epoxy resin and polymercaptan aminesCrystal Clear PRODUCT DETAILS Adhesion Strength: High Strength Container Size: 0.47 oz. Recommended Surface: Metal, Wood, China, Ceramic, Concrete, Stone, Fibe Solvent Resistant: No Color: Clear Full Cure Time: 1 hr. Working Time: 10 min Indoor or Outdoor: Indoor and Outdoor Product Form: Liquid.
089269051404, Rally 05140 Liqui-Cream Wax - 14 oz., , Hardware > Tools > Polishers & Buffers, Rally, https://images.barcodelookup.com/4985/49855616-1.jpg, , 
079700113105, Please and Edelman Tomkins 14 Oz Ultra Lube Multi Purpose Grease 11-310, Please And Edelman Tomkins, Hardware > Tools > Grease Guns, Please And Edelman Tomkins, https://images.barcodelookup.com/1234/12347347-1.jpg, 100, Omn1474:.
071691224235, Rubbermaid Bucket, 14 Qt (Pack of 6), Rubbermaid, Arts & Entertainment > Hobbies & Creative Arts > Musical Instrument & Orchestra Accessories > Brass Instrument Accessories > Brass Instrument Care & Cleaning > Brass Instrument Cleaners & Sanitizers, Rubbermaid, https://images.barcodelookup.com/7356/73564272-1.jpg, , Highlights: 14 Quart Heavy-duty wire bails offer extra durability for heavy use Twin spouts guide water flow from either side Recessed grips on bottom allow easy, controlled pouring Handle grips designed for comfortable carrying Bisque (Beige) with red handle Boxed.
037947193717, AAF 114201 Disposable Panel Filter, 20 in L, 14 in W, 575 Cfm 12 Pack, SEYMOUR OF SYCAMORE, Hardware > Power & Electrical Supplies > Power Inverters, SEYMOUR OF SYCAMORE, https://images.barcodelookup.com/1633/16337960-1.jpg, , ?StrataDensity? - Double sided skin fiberglass panels are constructed of continuous filament fiberglass pads, with a skin on both the air entering and air leaving sides. No metal backing. High volume construction, consists of a 4-pieces design, using moisture resistant chipboard material that is pre-printed with graphics. Frames are bonded with hot melt adhesive to the media pad around the entire perimeter of both sides of the filter. Frames are kraft colored, with colored printing. UL Classified in accordance with UL 900.
037947193755, AAF 114251 Disposable Panel Filter, 25 in L, 14 in W, 725 Cfm, Protect Plus, Hardware > Tools > Electrician Fish Tape, AAF International, https://images.barcodelookup.com/1925/19251864-1.jpg, , The EZ Flow II filter is made to function without a retainer by adhering the frame directly to the media, which has a light skin to make it self-retaining. The EZ Flow II frame is made from heavy chipboard in a one-piece design that eliminates corner separation. Sealing is accomplished with a resilient hot-melt adhesive running the full perimeter of the frame on both upstream and downstream sides.
029612242059, 15 Remote Extension Cord, PPP, Electronics > Electronics Accessories > Remote Controls, PPP, https://images.barcodelookup.com/1632/16324648-1.jpg, , 15 Remote Extension Cord.
029612242158, 15  Remote Extension Cord, , Hardware > Power & Electrical Supplies > Home Automation Kits, Ppp, http://s3images.shopletcdn.com/productimages/500x500/PPPCC24215.JPG, , Three 2-wire Outlets On Off Foot-switch Control Located 2 Ft From Plug Indoor Use Only Polarized Ul Listed 15 Ft Brown
024721063625, Irwin 316015 15 Piece Cobalt Drill Bits, IRWIN, Hardware > Tool Accessories > Drill & Screwdriver Accessories > Drill & Screwdriver Bits, IRWIN TOOLS, https://images.barcodelookup.com/1105/11058707-1.jpg, 1, Irwin*316015*Drill Bits & Accessories.
054732100910, Prime Wire & Cable EC502615 15 Ft. 16 - 03 - 15 SJTW Black Outdoor Extension Cord, Prime Wire & Cable, Electronics > Electronics Accessories > Cables > Network Cables, Prime Wire & Cable, https://images.barcodelookup.com/1130/11300378-1.jpg, 3.26lb, Features Outdoor extension cords Water-resistant, flame-retardant, ultra flexible, abrasion-resistant Nickel-coated brass blades resist corrosion. Color - Black Size - 15 ft.
093122630125, Drain Auger 1/4x15 T Grip, General Pipe Cleaners, Hardware > Hardware Accessories > Hardware Fasteners > Screws, General Pipe Cleaners, https://images.barcodelookup.com/3860/38607742-1.jpg, , DRAIN AUGER 1/4X15 T GRIP
045923073052, Satco S7305 15-Watt Medium Base Globe, 4100K, 120V, Equivalent to 60-Watt Incandescent Lamp, SATCO, Home & Garden > Lighting > Light Bulbs > LED Light Bulbs, Satco, https://images.barcodelookup.com/435/4354880-1.jpg, 1, .1 Average rated hours.15-Watt medium base.41K bright white bulb.Model number: S735.
032664325502, Cap Armored Vnyl 2w 15a, , Business & Industrial > Retail > Money Handling > Cash Register & POS Terminal Accessories > Credit Card Terminals, Cooper Wiring Devices, https://images.barcodelookup.com/4739/47393526-1.jpg, , 
032664326103, Cooper Wiring 2887-box Armored 3 Wire Grounded Electrical Connector, Yellow, Cooper Wiring, Home & Garden > Lawn & Garden > Gardening > Gardening Tools > Bulb Planting Tools, Cooper Wiring, https://images.barcodelookup.com/436/4364719-1.jpg, 0.7, Ideal for any high amperage industrial and commercial power connectivity application.
033923926614, Stanley 75-2080 Steel Small Screw Eye, Stanley, Hardware > Building Materials > Window Hardware > Window Cranks, Stanley, https://images.barcodelookup.com/1471/14713934-1.jpg, , "STANLEY HARDWARE " STEEL SMALL SCREW EYE Zinc plated Size: 15/32 Sharp points bite into wood easily. Rust resistant for use in exterior and interior applications. Carded.
082472340266, Lenox 34026-26A Arbored Hole Saw 1 5/8", , Hardware > Tool Accessories > Tool Blades > Saw Blades, LENOX, https://images.barcodelookup.com/7455/74552842-1.jpg, , Lenox 34026-26A Arbored Hole Saw 1 5/8" Brand: Lenox Type: Hole Saws & Hole Cutting Tool Accessories Color/Finish: White.
077578013817, Frost King A59/36h Door Bottom Sweeps, 1-5/8" X 36", Aluminum, Frost King, Hardware, Frost King, https://images.barcodelookup.com/1729/17299924-1.jpg, 0.4, Seals door from drafts, dirt, and insects. Aluminum and vinyl construction. Premium heavy gauge aluminum and vinyl sweep door bottom.
043374023787, M-d Building Products 02378 Insulated Foam Pipe Wrap, 1/8" X 2" X 15', M-D Building Products, Hardware > Building Materials > Insulation, M-D Building Products, https://images.barcodelookup.com/322/3220521-1.jpg, 0.6, .This insulated pipe wrap is constructed of polyvinyl chloride foam with aluminum shell. The aluminum shell reflects heat while the closed cell foam insulates and protects pipe. Installs easily using self adhesive backing.Highlights:.Width 1/8''.Height 2''.Length 15'.Finish Black/Silver.Closed Cell Foam - Insulated.Description Adhesive.
076812129505, Great Neck 1295 Homeowners Tool Set, 150 Piece, Great Neck, Hardware > Tools > Tool Sets > Hand Tool Sets, Great Neck, https://images.barcodelookup.com/8435/84356799-1.jpg, 6.35lb, Features High quality Chrome vanadium Blow mold case to keep the set organized 12 Ft tape measure 9" magnetic torpedo level with 3 vials 1" screwdriver bits including adapter in holders 150 Piece Includes6" long nose pliers,6" adjustable wrench, 6" diagonal pliers, 6" slip joint pliers, magnetic bit driver, 8 SAE hex keys, 8 metric hex keys, 9 1/4" drive SAE dockets, 6 precision screwdrivers in case, 90 fasteners in Case Specifications Weight: 6.35 lbs.
